佐賀県, 瑞浪市黒坂町
新潟県, 南佐久郡南相木村麻生
京都府, 山鹿市曲新町
群馬県, 新島村箕輪新田
福井県, 岩内郡岩内町春山町
福島県, 足立区西改田松の木
福井県, 東村山郡中山町小谷美濃山町
秋田県, 五島市大蔵
大阪府, 福岡市早良区居倉町
秋田県, 糟屋郡篠栗町白柏
鹿児島県, 児湯郡西米良村平野
岡山県, 日置市井内
群馬県, 日高郡日高川町新開
富山県, 都城市横井
徳島県, 鞍手郡小竹町麻生
愛知県, 田川郡福智町毛成
宮城県, 神石郡神石高原町宮丸
秋田県, 樺戸郡月形町城北町
青森県, 愛知郡東郷町上余戸
福井県, 京都市南区戸野目
山梨県, 飯石郡飯南町玉川町龍岡下
山梨県, 大野市廿五里
岐阜県, 尾道市仲西
山口県, 北九州市小倉北区多度町御衣野
鳥取県, 双葉郡川内村別府
宮城県, 大分市八幡町
愛知県, あわら市島原町
高知県, 大阪市旭区砂金町
愛媛県, 狭山市木ノ庄町木梨山方
長野県, 南魚沼郡湯沢町岩崎
静岡県, 本巣市上谷新田
山梨県, 南佐久郡南牧村桜
京都府, 嬉野市草安
愛知県, 国頭郡今帰仁村小国町七日町
長野県, 上川郡和寒町市野々
沖縄県, つくばみらい市光が丘
福井県, 橋本市柏原町田路
神奈川県, 秦野市大本
東京都, 小城市貴志川町岸宮
東京都, 北佐久郡立科町網干区田井
宮崎県, 岩瀬郡天栄村出石町宮内
和歌山県, 岩手郡葛巻町東原町
岩手県, 吉野郡天川村東勝原
宮城県, 庄原市三屋
徳島県, 仙北郡美郷町天王
長野県, 三重郡朝日町西平塚町
大阪府, 土佐清水市三土
岡山県, 掛川市光が丘
新潟県, 霧島市南美唄町上
広島県, 周智郡森町久保町
千葉県, 佐伯市高瀬町上麻
和歌山県, 東茨城郡茨城町高倉町
石川県, 下高井郡木島平村潮音寺
富山県, 新座市御坊山
兵庫県, 筑後市大冠町
石川県, 肝属郡東串良町台ケ窪
栃木県, 伊丹市岩崎
石川県, 日進市楽田三ツ塚
佐賀県, 川崎市川崎区越ケ谷本町
愛知県, 東臼杵郡美郷町神谷丙
長野県, 木曽郡木祖村奈摩郷
高知県, 日野郡日野町西春別駅前西町
東京都, 比企郡川島町仲西
島根県, 蒲生郡日野町川島田
香川県, 印旛郡栄町庄内町小挾間
長野県, 吾妻郡長野原町月美町
奈良県, 安八郡安八町真田
北海道, 度会郡度会町紺屋
富山県, 磯城郡三宅町山田町
福岡県, 唐津市中村桜町
宮崎県, 下都賀郡野木町高平
北海道, 武雄市稲荷町
香川県, 名古屋市北区大宮町
福島県, 佐久市西改田松の木
兵庫県, 東臼杵郡椎葉村魚町
愛知県, 日高郡美浜町美濃池町
愛知県, 国頭郡東村日ノ出
静岡県, 白山市祢津
岩手県, 最上郡戸沢村大瀬戸町雪浦久良木郷
秋田県, 掛川市大冠町
香川県, 大阪狭山市住吉町
北海道, 上水内郡信濃町野津町前河内
青森県, 南松浦郡新上五島町大杉
福岡県, 鳥取市大瀬東
静岡県, 西白河郡西郷村鹿勝川町
静岡県, 東白川郡塙町熨斗戸
長崎県, 志木市高砂町
長野県, 倉敷市周参見
静岡県, 伊達市右京町
鹿児島県, 三重郡川越町天応南町
島根県, 岩船郡関川村西平塚町
岡山県, 観音寺市新磯子町
福岡県, 鹿児島郡十島村柳
千葉県, 札幌市北区けやき台
群馬県, 遠田郡美里町鐘巻
大阪府, 中川郡幕別町西大寿台
千葉県, 生駒郡平群町二見町
北海道, 男鹿市鳥羽
青森県, 船橋市下新田
福井県, 泉北郡忠岡町岩崎
鹿児島県, 多治見市谷口
新潟県, 大牟田市高田町
香川県, 八幡市上早川
青森県, 上川郡上川町沢松
岐阜県, 中巨摩郡昭和町殿城
香川県, 比企郡小川町桜町
北海道, 燕市居倉町
京都府, 北葛飾郡松伏町宇筒原
栃木県, 南条郡南越前町竹野
京都府, 相楽郡笠置町小林
山梨県, 蒲生郡竜王町下西山
愛知県, 三島郡島本町南新町
石川県, 泉北郡忠岡町御供田
広島県, 駿東郡長泉町久々宇
長野県, 宮古市三口町
静岡県, 上野原市婦中町麦島
高知県, 蒲生郡竜王町宇筒原
秋田県, 大和高田市南新町
長野県, 倉吉市薬利
福井県, 知立市吾妻橋
埼玉県, 奥尻郡奥尻町浦川原区上柿野
宮崎県, 壱岐市上野新
長野県, 美唄市川島渡町
京都府, 橿原市馬島
和歌山県, 白老郡白老町谷田
奈良県, 多摩市富久山町南小泉
岩手県, 静岡市葵区舞崎町
佐賀県, 南房総市春山町
岡山県, 榛原郡川根本町ダイハツ町
愛媛県, 狭山市大和
佐賀県, 足寄郡足寄町豊里町長根浦
熊本県, 九戸郡九戸村昭和町
福島県, 糟屋郡久山町香南町由佐
大分県, 西牟婁郡白浜町栄
長野県, 日高郡日高川町西矢島町
山口県, 各務原市柏葉
栃木県, 北津軽郡中泊町下鴨高木町
大分県, 白石市深草石橋町
福岡県, 新潟市東区城新田
新潟県, 生駒市紺屋
静岡県, 邑智郡美郷町坪山
岩手県, 三浦市門田町
愛媛県, 鶴ヶ島市南方
島根県, 高知市前平町
奈良県, 船橋市梅園町
沖縄県, 加古郡播磨町大
和歌山県, みやま市曽根
群馬県, 西伯郡大山町苗振谷地
高知県, 郡山市東原町
鹿児島県, 室戸市江丹別町富原
宮崎県, 阪南市月舘
岡山県, 小豆郡小豆島町割田
新潟県, 飽海郡遊佐町新上条
長崎県, 羽島郡笠松町覚王寺
沖縄県, 山形市花園町
三重県, 綾歌郡綾川町額田南郷
京都府, 吉野郡黒滝村清水村松地先新田
山形県, 三方上中郡若狭町貝柄
和歌山県, 刈谷市丸山町
長野県, 岸和田市末広
群馬県, 加東市森安
静岡県, 龍ケ崎市太子堂
茨城県, 花巻市内馬場町
岩手県, 千葉市美浜区清川
北海道, 葛城市材木町
鳥取県, 中川郡美深町西軽部
奈良県, 郡山市永福町
静岡県, 利尻郡利尻町鳴子温泉南原
青森県, 西臼杵郡高千穂町香寺町中寺
千葉県, 西伯郡日吉津村三輪
新潟県, 国頭郡大宜味村西大寿台
千葉県, 富良野市山崎
三重県, 稲敷郡河内町市振
東京都, 十日町市絵下古賀
京都府, 千葉市若葉区寺沢前
宮崎県, 南蒲原郡田上町笹曽根町
山梨県, 白糠郡白糠町本島町甲生
熊本県, 川崎市幸区朽木平良
岩手県, 大島郡宇検村丸山町
東京都, 塩竈市箕輪
岩手県, 北区神指町如来堂
鳥取県, 足柄上郡大井町八雲町東岩坂
長野県, 立川市黒流町
静岡県, 猿島郡五霞町新開
三重県, 今立郡池田町京町
岩手県, 諏訪市草安
石川県, 仙台市太白区潮見台
愛媛県, 真庭市長沢町
北海道, 札幌市南区藤代町
秋田県, 大崎市新町
愛知県, 網走市紫野東御所田町
千葉県, 八頭郡若桜町出石町宮内
山形県, 吾妻郡中之条町昭和町
鳥取県, 川越市松尾町借毛本郷
大分県, 島牧郡島牧村遊子
福井県, 輪島市桂町
青森県, 伊達市加茂町南大門
山形県, 山梨市喜念
栃木県, 須坂市平佛供田町
島根県, 豊前市楯山
石川県, 栃木市花園町
富山県, 下妻市本吉町深萩
広島県, 球磨郡湯前町中央町
埼玉県, 大島郡与論町紺屋
徳島県, 碧南市末広
福岡県, 甲州市大本
広島県, 中川郡本別町花園町
埼玉県, 加美郡加美町芹中町
茨城県, 栗原市下日出谷西
静岡県, 南津軽郡田舎館村上渋井
長崎県, 三養基郡上峰町材木町
大阪府, 益田市宮川町小谷
群馬県, ひたちなか市桧岱
長野県, 知立市烏出川
香川県, 西八代郡市川三郷町元土御門町
広島県, 印旛郡栄町三重
長野県, 三方郡美浜町大橋町
兵庫県, 沖縄市元学町
埼玉県, 上北郡横浜町麻布狸穴町
福井県, 枝幸郡浜頓別町岩崎
大阪府, 大阪市大正区芝之町
青森県, 虻田郡洞爺湖町柿崎区城腰
三重県, 仙台市宮城野区木葉下町
佐賀県, 勝田郡奈義町中
山形県, 中新川郡立山町調川町平尾免
埼玉県, 嘉穂郡桂川町平和町
東京都, 芳賀郡益子町屋敷
富山県, 多賀城市木戸
山口県, 安芸郡馬路村赤尾
大阪府, 名古屋市中川区吉舎町敷地
青森県, 黒部市下岩田
富山県, 青梅市安行藤八
福井県, 中野区材木町
神奈川県, 南巨摩郡身延町朽木平良
宮城県, うきは市山那
島根県, 宝塚市天王
奈良県, 堺市東区母子
神奈川県, 東かがわ市寄近町
沖縄県, 西多摩郡檜原村成合
北海道, 度会郡南伊勢町窪田町藤泉
大阪府, 安中市磯浜町
青森県, 鎌ケ谷市久美浜町葛野
佐賀県, 沼田市七日町
福島県, 高岡郡檮原町下日出谷西
宮城県, 今治市古屋敷町
石川県, 下松市大蓮東
沖縄県, 総社市金山沢
三重県, 府中市有楽町
高知県, 大阪市東成区下荒又
栃木県, 柳川市竹下
愛媛県, 邑楽郡大泉町宇和町杢所
富山県, 茅部郡鹿部町幡生町
三重県, 千葉市美浜区奥沢
愛知県, 大島郡徳之島町中村道ノ下
広島県, 豊前市東町
石川県, 鎌ケ谷市所谷町
埼玉県, 笠岡市太田原
島根県, 安芸郡熊野町仲西
新潟県, 八頭郡八頭町安条
新潟県, 江東区松尾
山口県, 中頭郡中城村清尾
高知県, 北足立郡伊奈町祢津
栃木県, 河東郡上士幌町西日暮里
茨城県, 下高井郡野沢温泉村大津元町
奈良県, 八頭郡八頭町毛成
高知県, 球磨郡球磨村芝之町
鹿児島県, 東金市五畳敷
鹿児島県, 安芸郡北川村西落合
岐阜県, 横浜市南区波積町本郷
滋賀県, 最上郡大蔵村今里
宮城県, 北相馬郡利根町楽田三ツ塚
滋賀県, 菊川市高坂
神奈川県, 上水内郡飯綱町土師町
三重県, 守口市福岡中央
長野県, 日向市青海川
高知県, 大沼郡金山町本山町岡本
秋田県, 南佐久郡川上村西村町
徳島県, 島牧郡島牧村上田町
岡山県, 宇佐市市振
岐阜県, 西置賜郡小国町立川町
宮崎県, 西宮市平佛供田町
鳥取県, 富士市福田
愛知県, 十和田市新浜町
千葉県, 最上郡金山町宮野下
滋賀県, 岩倉市川口町
茨城県, 田川郡大任町大谷
岩手県, 大洲市扇町
山形県, 久慈郡大子町新浦島町
秋田県, 小松市井岡
山梨県, 杵築市居倉町
島根県, 八街市けやき台
滋賀県, 菊池郡菊陽町立石
愛知県, 白石市五畳敷
鳥取県, 石岡市宇治町宇治
岡山県, 長岡郡大豊町緑台
鳥取県, 乙訓郡大山崎町柚木
熊本県, つがる市綾田町
島根県, 仁多郡奥出雲町稲毛町
茨城県, 宮古郡多良間村木ノ庄町木梨山方
岐阜県, 大垣市陸田宮前町
兵庫県, 宗谷郡猿払村香南町由佐
福井県, 善通寺市古市場東町田
京都府, 滑川市中津川
栃木県, 板野郡北島町坂井町若宮
鹿児島県, 綾歌郡綾川町黒坂町
大分県, 高岡市割田
秋田県, 釧路市桜の町
京都府, 苫前郡初山別村薬師堂町
北海道, 比企郡滑川町麻生
福岡県, 隠岐郡知夫村御蔵島村一円
福岡県, 東筑摩郡生坂村片口久々江
香川県, 賀茂郡松崎町上黒瀬
富山県, 志布志市新浜町
京都府, 南あわじ市中津川
大阪府, 加東市木戸
佐賀県, 球磨郡錦町常盤町
愛媛県, 西置賜郡小国町中村道ノ下
和歌山県, 芳賀郡芳賀町樫原分田
愛媛県, 下伊那郡阿智村本吉町深萩
高知県, 雨竜郡北竜町呉服町
沖縄県, 久遠郡せたな町問屋町
愛知県, 日高郡みなべ町陸田宮前町
沖縄県, 海部郡美波町西鴻池町
沖縄県, 虻田郡洞爺湖町御津町豊沢樽美
山形県, 伊達郡国見町陽光園
香川県, 柴田郡村田町坂本
静岡県, 三戸郡田子町八角町
和歌山県, 世田谷区南中山
東京都, 天塩郡遠別町久保町
広島県, 利尻郡利尻富士町北中
長崎県, 茨木市多度町御衣野
秋田県, 東臼杵郡椎葉村須木奈佐木
埼玉県, 遠賀郡岡垣町池見
長崎県, 長生郡睦沢町海津町高須町
青森県, 邑楽郡大泉町美熊台
宮城県, 日南市東城内
山口県, 宮城郡松島町八島町
鳥取県, 玉名郡南関町元町
山形県, 名古屋市千種区石上
静岡県, 名古屋市港区野々井
和歌山県, 雨竜郡雨竜町高瀬町上麻
岡山県, 輪島市幸田新田
京都府, 美作市上郷町来内
福岡県, 新潟市南区東野町西神田
和歌山県, 北九州市戸畑区宇治町宇治
岩手県, 亘理郡山元町成合
兵庫県, 気仙沼市出合
滋賀県, 輪島市平町
神奈川県, 島尻郡座間味村葛川
奈良県, 大阪市北区新宮町市野保
長野県, 日南市松林
岩手県, 福岡市中央区安津見
佐賀県, 爾志郡乙部町国府町和田
三重県, 新潟市南区北中
岐阜県, 加茂郡白川町水橋下砂子坂
兵庫県, 北都留郡丹波山村上磯分内
福井県, 南埼玉郡宮代町向日比
宮城県, 足寄郡足寄町今宿
滋賀県, 日野郡日南町曽根
熊本県, 高萩市増穂
青森県, 北九州市戸畑区碇ケ関古懸鳥井
岡山県, 愛知郡東郷町古町
福岡県, 小豆郡土庄町元魚町
青森県, 台東区上丹生
宮城県, 韮崎市前崎西町
愛知県, 島尻郡南風原町上西郷
埼玉県, 尾花沢市材木町
青森県, 新宿区上鳥羽南中ノ坪町
兵庫県, 広島市中区上段
神奈川県, 板橋区寄木町秋葉
兵庫県, 佐伯市東野町西神田
新潟県, 二海郡八雲町八幡崎本宮
山口県, 東牟婁郡太地町米島
愛知県, 大月市堀口町
富山県, 鴻巣市南部領辻
徳島県, 小金井市高山
愛媛県, 串間市米山町愛宕前
香川県, 泉南郡岬町栄町
長野県, 前橋市須々木
島根県, 柳川市雷鳥沢
東京都, 北都留郡丹波山村美山町和泉
静岡県, 稲沢市百々西町
兵庫県, 東筑摩郡朝日村十三東
愛媛県, 加東市只野
栃木県, 虻田郡喜茂別町明和通
熊本県, 敦賀市鉢
福井県, 広島市安佐南区福井
青森県, 安芸郡海田町磯部
栃木県, 北安曇郡池田町仲町
徳島県, 築上郡吉富町大淀南
三重県, 寝屋川市三ツ矢橋
宮崎県, 入間郡毛呂山町桂町
岩手県, 阿蘇市呉服町
福島県, 斜里郡清里町上宇野令
岡山県, 下田市灘
山梨県, 白岡市月舘
三重県, 小城市小栗栖石川町
兵庫県, 諏訪郡下諏訪町前田
秋田県, 田川郡大任町芸濃町中縄
大阪府, 北津軽郡中泊町庄内町小挾間
徳島県, 西都市宝来
山口県, 土佐市上野新
宮崎県, 大川市大牟礼
群馬県, 三鷹市大
石川県, 春日市山田町
新潟県, 射水市畑中
広島県, 朝霞市柿
山梨県, 大牟田市大平
山梨県, にかほ市御供田
和歌山県, 賀茂郡南伊豆町大冠町
宮城県, あわら市佐方
高知県, 耶麻郡西会津町羽黒起
長野県, 尼崎市江上町
愛媛県, 藤津郡太良町与田川尻
岩手県, 知多市今市
滋賀県, 目黒区岩井
秋田県, 山本郡八峰町竹下
青森県, 甘楽郡甘楽町和良町宮地
富山県, 天草市飯沢
東京都, 姶良郡湧水町大通北
大分県, 吹田市田井
新潟県, 南九州市北方町板上
京都府, 豊川市北沢
和歌山県, 中頭郡北谷町岩井
群馬県, 大田区成田
徳島県, 長野市木葉下町
高知県, 川崎市川崎区甲賀町毛枚
沖縄県, 柴田郡柴田町舘山寺町
静岡県, 東臼杵郡美郷町材木町
京都府, 高砂市柚木
大分県, 浅口市白柏
高知県, 三戸郡田子町八潮
宮崎県, 坂出市吉田町
大阪府, 行橋市中新
徳島県, 大阪市西淀川区三土
群馬県, 境港市光陽町
神奈川県, 広島市安佐北区多田院西
山梨県, 西伯郡日吉津村芙蓉
京都府, 可児郡御嵩町日置野田
岡山県, 海部郡飛島村清水村松地先新田
佐賀県, 天童市大橋
京都府, 新潟市北区材木町
青森県, 高市郡明日香村藤代町
山形県, 柳川市下津林番条町
宮城県, 鹿島市俵柳
福島県, 天塩郡遠別町天満下川原
滋賀県, 彦根市霞町
佐賀県, 岩内郡岩内町舘野
栃木県, さいたま市岩槻区天王下
北海道, 夷隅郡御宿町大瀬戸町雪浦久良木郷
福島県, 足柄下郡湯河原町清水村松地先新田
栃木県, 羽島郡笠松町笛堂
山梨県, 遠賀郡芦屋町築館沢入
福井県, 糟屋郡粕屋町絵下古賀
奈良県, 白井市高下西町
鳥取県, 東彼杵郡東彼杵町モエレ沼公園
神奈川県, 泉大津市甲賀町毛枚
岡山県, 名寄市力丸町
山口県, 大牟田市南倉沢
栃木県, 北群馬郡吉岡町白根日の出町
熊本県, うきは市生出塚
香川県, 飯山市東沢田
三重県, 箕面市調川町平尾免
滋賀県, 海部郡蟹江町梅園町
香川県, 東かがわ市西川面
奈良県, 東温市幸町
奈良県, 安城市紙敷
栃木県, 高浜市小城町
千葉県, 古河市汐手が丘
鹿児島県, 豊前市尾崎丁
山形県, 印西市飾東町北山
鹿児島県, 羽咋郡宝達志水町南起
宮城県, 桶川市片口久々江
滋賀県, 南佐久郡北相木村小口川
島根県, 栗原市吉田町
石川県, 十和田市対雁
熊本県, 樺戸郡新十津川町南新町
大阪府, 宜野湾市中央町
三重県, 千歳市弓越
大分県, 松浦市羽黒起
静岡県, 木更津市只野
山口県, 吾妻郡嬬恋村土師町
滋賀県, 熊毛郡南種子町東浜町
岩手県, 岩船郡粟島浦村直島町一円
神奈川県, 東久留米市久々宇
岩手県, 京都市伏見区二本木
栃木県, 御前崎市今里
岡山県, 飯山市国見町鬼籠
香川県, 奈良市柏原町田路
福岡県, 築上郡上毛町中子
愛知県, 名西郡石井町竹下
東京都, 藤井寺市早通
岐阜県, 阿蘇郡産山村今岡町
大阪府, 岸和田市岸城町
福島県, 伊都郡高野町成子町
石川県, 虻田郡喜茂別町石名坂
島根県, 南都留郡鳴沢村山那
山梨県, 山県郡北広島町出石町宮内
広島県, 長生郡長南町浪岡北中野
富山県, 八街市落合町
岩手県, 香美市岩作隅田
島根県, 相楽郡笠置町金屋谷
山口県, 伊賀市安津見
茨城県, 杵島郡白石町野津町前河内
香川県, 泉北郡忠岡町神戸港地方
岩手県, 横浜市中区蛭谷
広島県, 鞍手郡鞍手町鹿勝川町
山口県, 海部郡蟹江町海津町高須町
高知県, 大阪市東淀川区井内
愛知県, 芳賀郡茂木町童仙房
岐阜県, 名古屋市名東区西ノ京笠殿町
岡山県, 東筑摩郡山形村出合
和歌山県, 古平郡古平町佐渡
高知県, 河沼郡湯川村蛭子町
宮崎県, 小浜市佐久間町大井
佐賀県, 鹿島市高山
大阪府, 境港市白鳥町
群馬県, 黒石市台ケ窪
長野県, 岐阜市平野
新潟県, 国東市喜念
三重県, 厚木市芦川町鶯宿
山梨県, 土浦市灘
埼玉県, 安八郡安八町桂町
兵庫県, 芳賀郡茂木町三和区川浦
青森県, 日田市東町
香川県, 印旛郡酒々井町三隅町井川
奈良県, 秩父郡東秩父村甲賀町毛枚
福岡県, 北津軽郡中泊町木山
島根県, 土浦市万代町
滋賀県, 杵築市西町
香川県, 目梨郡羅臼町佐渡
富山県, 広尾郡大樹町古川町
愛知県, 秦野市二の宮
兵庫県, 高岡市八角町
大分県, 新宿区伏木古府元町
茨城県, 杵島郡江北町鴨居
大阪府, 北佐久郡御代田町十日町
山形県, 福岡市早良区城新田
高知県, 大島郡瀬戸内町寺中町
長崎県, 可児郡御嵩町清尾
宮崎県, 三鷹市高倉町
栃木県, 南蒲原郡田上町屋敷
岡山県, 比企郡吉見町西大寿台
山形県, 英田郡西粟倉村熨斗戸
千葉県, 向日市学園赤松町
三重県, 吉野郡下市町菜園場
鹿児島県, 厚木市五輪原
福井県, 合志市島原町
島根県, 綾部市三潴町清松
北海道, 高槻市石田町池田仲触
茨城県, 上水内郡飯綱町松林
山梨県, 石狩郡新篠津村土生
石川県, 大野市万代町
静岡県, 一関市福瀬町
福井県, 薩摩川内市鹿立
山形県, 東村山郡中山町高下西町
愛知県, 沼津市楯山
富山県, 名護市桜川町
高知県, 高岡郡中土佐町常盤町
沖縄県, 大館市向横田町
埼玉県, 加美郡加美町峰山町四軒
岐阜県, 熊毛郡中種子町花丘町
埼玉県, 安房郡鋸南町豊岡
石川県, 横浜市都筑区福岡中央
和歌山県, 高浜市舞崎町
岩手県, 勝浦郡上勝町浄法寺町飛鳥谷地
愛媛県, 国頭郡国頭村大浜
新潟県, 吉野郡下市町上田町
京都府, 北葛城郡上牧町平野
福岡県, 和歌山市犬伏
栃木県, 村上市日和山下
島根県, 和泉市額塚
三重県, 川崎市高津区更木
栃木県, 西多摩郡瑞穂町小折東町旭
和歌山県, 耶麻郡猪苗代町鵜飼年毛
石川県, 上水内郡信濃町四日町
神奈川県, 大沼郡三島町雄町
青森県, 鶴岡市浪速
大阪府, 札幌市中央区婦中町麦島
香川県, 横浜市瀬谷区下甑町片野浦
北海道, 真岡市上丹生
鹿児島県, 最上郡大蔵村多田院西
福島県, 北松浦郡小値賀町楽田三ツ塚
石川県, 伊丹市松岡
新潟県, 石狩郡当別町八倉
茨城県, 鞍手郡小竹町額田南郷
福岡県, 豊川市別府
大分県, 丹生郡越前町久野本
山形県, 白石市滝尾
大分県, 倉吉市雷鳥沢
和歌山県, 相馬郡飯舘村明和通
埼玉県, 西之表市万代町
秋田県, 東牟婁郡古座川町中津隈
宮崎県, 佐渡市網干区田井
富山県, 長岡市加茂内町
沖縄県, 勇払郡むかわ町西大寺新
群馬県, 邑楽郡大泉町童仙房
広島県, 虻田郡留寿都村貝少
岩手県, 上田市沓掛
鳥取県, 児玉郡美里町和泉
群馬県, 交野市一乗寺病ダレ
富山県, 留萌郡小平町砂子
三重県, 大島郡天城町西谷
広島県, 八重山郡与那国町高来町法川
福岡県, 北葛城郡河合町山王町
秋田県, 伊東市曲新町
愛媛県, 宮若市木津屋町
富山県, 相生市奥沢
佐賀県, 勝浦郡勝浦町相川羽田町
長野県, 糸島市小枕
埼玉県, 幸手市正雀
栃木県, つくば市那加野畑町
和歌山県, 大飯郡高浜町岩作隅田
新潟県, 堺市西区加茂内町
山梨県, 柏原市鈴が峰町
熊本県, 名東郡佐那河内村大平
奈良県, 糟屋郡新宮町加茂内町
新潟県, 国頭郡大宜味村赤城町
東京都, 吾川郡いの町箕輪
長崎県, 久慈郡大子町兎内上保土沢
神奈川県, 竹田市深草森吉町
佐賀県, 相馬郡飯舘村十日町
岡山県, 大牟田市八田
岐阜県, 新座市吾妻橋
三重県, 泉南市雷鳥沢
神奈川県, 大月市大瀬戸町雪浦久良木郷
茨城県, 都窪郡早島町谷田
岡山県, 横浜市西区宍道町白石
香川県, 西白河郡矢吹町大江町毛原
広島県, さいたま市西区大牟礼
群馬県, 門真市有海
岩手県, 賀茂郡松崎町高崎町縄瀬
兵庫県, 岩国市西町
愛媛県, 北葛城郡上牧町引佐町栃窪
島根県, 上田市黒坂町
愛媛県, 東田川郡庄内町すずらん台南町
富山県, 邑楽郡明和町赤浜栄町
埼玉県, 甲賀市本島町甲生
岐阜県, 北杜市永田
広島県, 隠岐郡西ノ島町嵯峨蜻蛉尻町
福島県, 網走市安土町宮津
奈良県, 幡多郡大月町清水村松地先新田
大分県, 築上郡上毛町森安
鹿児島県, 肝属郡南大隅町赤松台
大分県, 高岡郡越知町加子母
奈良県, 河沼郡湯川村前沢区二十人町
栃木県, 田村郡三春町つくも町
熊本県, 知立市栄町
沖縄県, 相模原市南区大本
京都府, 宮古市二ノ平
岡山県, 中頭郡西原町堀内
千葉県, 大阪市淀川区桜川町
岐阜県, 中新川郡立山町富和
青森県, 太田市岩名
愛媛県, 小松島市岩崎西
佐賀県, 沼田市本郷町
滋賀県, 長岡市八尾町井田
京都府, 薩摩郡さつま町田町
熊本県, 西村山郡大江町極楽寺
宮崎県, 北設楽郡東栄町富久山町南小泉
富山県, 旭川市新町
愛知県, 勇払郡むかわ町五畳敷
千葉県, 鞍手郡小竹町円山町
三重県, 上川郡東川町松山
徳島県, 南都留郡西桂町明和通
茨城県, 八重山郡与那国町北原東
富山県, 空知郡上砂川町栄町
富山県, 土岐市南金屋
鹿児島県, 利根郡川場村百々西町
京都府, 西尾市岩崎西
兵庫県, 浜松市中区宇和町杢所
神奈川県, 斜里郡小清水町陽光園
山形県, 石狩市鯖石
長崎県, 長岡京市高山
東京都, 東臼杵郡椎葉村奈川
愛媛県, 諏訪市国府町和田
三重県, 東松島市野沢町
滋賀県, 尾花沢市西改田松の木
鹿児島県, 中郡二宮町八百屋町
静岡県, 大島郡知名町熊谷
高知県, 東広島市園原
福島県, 所沢市志津川磯の沢
島根県, 天理市下新田
栃木県, 臼杵市上奈良東ノ口
神奈川県, 塩谷郡塩谷町木山
島根県, 茨木市波多津町津留主屋
石川県, 球磨郡錦町衣川区桧山沢
宮崎県, 新発田市対雁
愛知県, 佐渡市すずらん台南町
岩手県, 東津軽郡蓬田村五畳敷
長野県, 高知市下岩田
愛知県, 利尻郡利尻富士町岸城町
山形県, 歌志内市白柏
山梨県, 安八郡安八町東上秋間
栃木県, 座間市貝柄
香川県, 佐久市高砂町
長野県, 新潟市北区神戸港地方
福島県, 熊毛郡屋久島町三宝町
徳島県, 多野郡上野村西改田松の木
