佐賀県, 瑞浪市黒坂町
岐阜県, 二海郡八雲町田代
福岡県, 仲多度郡多度津町舘野
岩手県, 安芸郡安田町古市場東町田
愛知県, 阿蘇郡南小国町浜谷町
鳥取県, 小笠原村熊谷
山梨県, 西置賜郡白鷹町高倉町
茨城県, 和光市花丘町
宮城県, 諏訪郡富士見町浪速
石川県, 九戸郡九戸村今宿
新潟県, 磯城郡田原本町神岡町数河
大阪府, 東松山市松崎馬場
滋賀県, 空知郡上富良野町石上
滋賀県, 湖南市喰代
愛知県, 中津川市和泉
三重県, 上伊那郡辰野町岩作隅田
埼玉県, 神崎郡福崎町雄町
栃木県, 雄勝郡東成瀬村三川
京都府, 仙台市宮城野区御津町豊沢樽美
島根県, 能美郡川北町天王下
沖縄県, 東国東郡姫島村大瀬東
愛知県, 大島郡瀬戸内町幸町
長崎県, 田川郡香春町浦川原区上柿野
福井県, 泉大津市八倉
鳥取県, 赤穂市稲毛町
徳島県, 三浦市南中山
山口県, 気仙郡住田町楯山
広島県, 藤沢市立川町
山口県, 八千代市中新
岡山県, 福島市富合町硴江
兵庫県, 名寄市安津見
徳島県, 旭川市梨木町
秋田県, 長岡京市南部領辻
山梨県, 美方郡新温泉町和見町
静岡県, 山武郡芝山町西生来町
宮城県, 那須烏山市西恋ケ窪
鹿児島県, 上川郡和寒町太秦安井藤ノ木町
京都府, 不破郡垂井町日の後
愛媛県, 深川市南倉沢
福岡県, 駒ヶ根市山川町牛ノ子尾
滋賀県, 下高井郡野沢温泉村立石町
栃木県, 中川郡豊頃町赤松台
富山県, 仲多度郡琴平町麻布狸穴町
広島県, 児湯郡川南町太田原
大阪府, 阿武郡阿武町草積町
東京都, 紋別市大
北海道, 南埼玉郡宮代町東町
栃木県, 三戸郡田子町大田沓掛
兵庫県, 天塩郡遠別町西町
岡山県, 大野城市落合町
和歌山県, 加茂郡川辺町田町
熊本県, 中頭郡嘉手納町里見町
愛媛県, 徳島市上鳥羽南中ノ坪町
香川県, 足柄上郡大井町下野上
奈良県, 美唄市谷口
富山県, うきは市前田
福岡県, 下伊那郡豊丘村岩崎西
高知県, 知多郡南知多町小畠
島根県, 名古屋市西区南方
神奈川県, 鞍手郡鞍手町神田佐久間河岸
栃木県, 北広島市小瀬沢
鳥取県, 三郷市鹿勝川町
大分県, 丹波市下西山
熊本県, 京都郡苅田町新開町
三重県, 飯石郡飯南町里の杜
広島県, 新潟市江南区駒ケ谷
鹿児島県, 西津軽郡鰺ヶ沢町東城内
島根県, 西村山郡西川町草安
宮城県, 坂戸市岩倉
大分県, つくば市来住町
大分県, 不破郡関ケ原町寄近町
群馬県, 高岡郡越知町下新田
富山県, 岩沼市紙敷
島根県, 入間郡三芳町池下裏
静岡県, 高岡郡四万十町石名坂
福島県, 西彼杵郡時津町東大島
山口県, 伊勢崎市造谷
岐阜県, 北都留郡小菅村栄
北海道, 上伊那郡箕輪町宇留院内
三重県, 登別市伏木古府元町
愛媛県, 知多郡美浜町飯
奈良県, 大阪狭山市湯来町多田
和歌山県, 諏訪郡原村国分北
鹿児島県, 牛久市大助
福岡県, 田川市木伏
福島県, 栗原市山川町牛ノ子尾
和歌山県, 葦北郡芦北町復井町
山口県, 佐伯市奔渡
山梨県, 国頭郡恩納村寄近町
石川県, 河東郡上士幌町御津町金野袋田
山口県, 北蒲原郡聖籠町柳原町
宮崎県, 熊本市中央区白柏
佐賀県, 薩摩郡さつま町今畑
大分県, 伊勢原市大野町代三五
熊本県, 中央区額田南郷
三重県, 下呂市浪岡北中野
鹿児島県, 日高郡印南町萩原町河田方
宮城県, 南佐久郡南牧村中之町
岩手県, 四日市市龍岡町下條南割
石川県, 厚岸郡厚岸町上鳥羽南中ノ坪町
神奈川県, 駿東郡長泉町沢松
和歌山県, 養老郡養老町和田山町岡田
徳島県, 札幌市西区上鴻之舞
岡山県, 安八郡安八町七日町
鳥取県, 上北郡おいらせ町貴志川町岸宮
広島県, 徳島市中之町
京都府, 高市郡明日香村天白町植田
大分県, 下関市藤代町
熊本県, 東彼杵郡東彼杵町長沢町
静岡県, 三宅島三宅村高山町
鳥取県, 静岡市葵区宇治町宇治
東京都, 桑名市美川町四馬神
福井県, 中新川郡舟橋村天神
福岡県, 京丹後市菜園場
鳥取県, 浜松市浜北区西生来町
神奈川県, 海部郡牟岐町竹下
高知県, 鹿島市氷上町絹山
神奈川県, 下田市上三俣
静岡県, 葛飾区富久山町南小泉
長崎県, 東津軽郡今別町木戸
山梨県, 三潴郡大木町壬生甲
沖縄県, 大垣市津島町
群馬県, 調布市光町
新潟県, 滑川市竹田向代町川町
神奈川県, 南秋田郡八郎潟町北七区
沖縄県, 札幌市東区神田佐久間河岸
東京都, 双葉郡浪江町茗荷沢新田
兵庫県, 天草郡苓北町竹野町浜須井
福岡県, 上北郡七戸町国衙
静岡県, 東茨城郡城里町御蔵島村一円
神奈川県, 浜松市南区旭町
徳島県, 山武市田代
島根県, 双葉郡富岡町美星町烏頭
福岡県, 苫小牧市真田
愛知県, 新発田市御蔵島村一円
茨城県, 鹿角市堀川町
岩手県, 名寄市厳木町牧瀬
岡山県, 益田市福岡中央
長野県, 掛川市川辺町両添
群馬県, さいたま市岩槻区造谷
長崎県, 伊佐市指扇領辻
群馬県, 桜井市梁川町上川原
熊本県, 八幡平市魚町
茨城県, 川西市上神輿町
福島県, 上川郡東川町沢松
山梨県, 国立市平和町
石川県, 佐渡市本宮町
千葉県, 度会郡南伊勢町宮野下
群馬県, 神戸市東灘区中畑町
奈良県, 東海市高下西町
神奈川県, 瑞浪市西大寿台
岐阜県, 安達郡大玉村大原
茨城県, 井原市久々宇
石川県, 中央区沢口
京都府, 西津軽郡鰺ヶ沢町高来町法川
静岡県, 木曽郡木曽町滝尾
大阪府, 東伯郡北栄町北原東
愛知県, 宮古市春野町内ノ谷
新潟県, 松前郡福島町落合町
大阪府, 堺市東区員弁町平古
熊本県, 礼文郡礼文町正岡神田
静岡県, 鹿足郡津和野町周防町
京都府, 大野城市旦土
大分県, 相馬市三屋
山口県, 糸満市前河原
鹿児島県, 三島郡島本町大平
茨城県, 西置賜郡飯豊町久美浜町葛野
沖縄県, 遠田郡美里町堀川町
大分県, 球磨郡多良木町上田町
鹿児島県, 茅ヶ崎市富久山町南小泉
静岡県, 守山市居能町
鳥取県, 海部郡海陽町笹曽根町
宮城県, 泉佐野市赤尾
栃木県, 沙流郡平取町新堀新田
青森県, 墨田区高新田
三重県, 本庄市田宮本町
熊本県, 西彼杵郡時津町薬利
三重県, 滑川市高瀬町上麻
長崎県, 豊田郡大崎上島町米島
奈良県, 菊池市東立神町
山形県, 茅野市磯浜町
埼玉県, 印旛郡栄町仁川高台
愛知県, 名古屋市昭和区沢口
山口県, 安八郡神戸町森川町
高知県, 福岡市早良区今畑
島根県, 白老郡白老町大西町宮脇
茨城県, 比企郡ときがわ町厳木町牧瀬
岐阜県, 下閉伊郡岩泉町五輪原
佐賀県, 瑞穂市成合南の町
東京都, 児玉郡神川町八幡崎本宮
石川県, 国頭郡今帰仁村夜須町羽尾
岡山県, 板野郡北島町西川面
静岡県, 伊万里市下白岩町
山形県, 安曇野市滝元
群馬県, 佐賀市北原山町鳴湫
青森県, 上益城郡甲佐町正岡神田
兵庫県, 熊毛郡中種子町下梨
茨城県, 鹿屋市犬伏
青森県, 志摩市大橋町
和歌山県, 島田市上組郷
岩手県, 神戸市灘区八倉
福井県, 多気郡明和町児島小川
栃木県, 白山市高清水上佐野
栃木県, 黒部市婦中町麦島
京都府, 河沼郡湯川村三郷
京都府, 伊豆市四日町
徳島県, 秩父郡長瀞町長瀬
京都府, 三方上中郡若狭町石名坂
大阪府, 関市清水村松地先新田
青森県, 板橋区久崎
徳島県, 上野原市吉美
滋賀県, 豊田郡大崎上島町吹込
宮城県, 国頭郡本部町開田
埼玉県, 松浦市徳山
鹿児島県, 飯石郡飯南町出雲
愛媛県, 邑楽郡明和町小池
千葉県, 浦河郡浦河町深草森吉町
兵庫県, 遠田郡美里町西町
静岡県, 美方郡香美町嬉野上野町
石川県, 苫前郡羽幌町菜園場
秋田県, 安芸郡芸西村材木町
奈良県, 上野原市光が丘
佐賀県, 大沼郡昭和村小林
岐阜県, 東牟婁郡古座川町豊郷
山形県, 周南市寺中町
岐阜県, 綴喜郡井手町大戸町石村
愛知県, 豊能郡能勢町宿原
熊本県, 筑西市東本宿
神奈川県, 安中市東中野
北海道, 三田市宮ノ入
徳島県, 大阪市東淀川区馬島
和歌山県, 東牟婁郡古座川町香寺町中寺
奈良県, 諏訪市三川
徳島県, 下伊那郡阿南町大蔵
大分県, 文京区片倉町
石川県, 竹原市下新庄町
山口県, 海部郡大治町姥袋町
山形県, 邑楽郡板倉町笛舞
長野県, 高槻市下白岩町
香川県, 揖斐郡揖斐川町松岡
東京都, 小樽市大戸町石村
石川県, 名古屋市名東区童仙房
福岡県, 北九州市八幡東区三口町
佐賀県, 綾部市壬生
愛知県, 阿蘇郡産山村内馬場町
高知県, 各務原市中町
群馬県, 富士市桂町
福岡県, 三好市南倉沢
山梨県, 児湯郡高鍋町油町
宮崎県, 横浜市栄区桜
大分県, 大阪市鶴見区祢津
神奈川県, 鹿角市大森町堂林
鹿児島県, 枝幸郡中頓別町温泉
静岡県, 宇佐市久米
和歌山県, つくばみらい市丸島町
山口県, 瀬棚郡今金町上丹生
群馬県, 国分寺市久米野
北海道, 東伯郡三朝町二見町
兵庫県, 善通寺市堀口町
石川県, 北葛城郡河合町小高区上町
沖縄県, いわき市丹原町池田
岐阜県, 大島郡瀬戸内町愛の杜
和歌山県, 増毛郡増毛町石垣町西側
大阪府, 児湯郡新富町国衙
高知県, 東大和市高砂町
群馬県, 綴喜郡井手町十三東
京都府, 西彼杵郡時津町衣川区桧山沢
埼玉県, 新居浜市東野町西神田
香川県, 東松山市北中
熊本県, 大島郡天城町蛭谷
岩手県, 笠岡市松山
鳥取県, 中野区二俣
静岡県, 東臼杵郡椎葉村舟屋町
秋田県, 中郡二宮町東原町
神奈川県, 下田市福岡中央
岡山県, 三潴郡大木町神山
三重県, 北九州市小倉北区宝来
山形県, 双葉郡川内村上段
島根県, 菊池市早苗町
茨城県, 糟屋郡宇美町碁点
香川県, 広島市佐伯区谷田
群馬県, 調布市古川宮沢
鹿児島県, 善通寺市古町
和歌山県, 千葉市花見川区二見町
香川県, 気仙沼市小枕
岡山県, 浦河郡浦河町屋敷
福岡県, 長崎市西生来町
富山県, 御坊市花園町
広島県, 愛西市宮川町小谷
秋田県, 坂出市塚原新田
滋賀県, 栗東市村高町
滋賀県, 河東郡士幌町寿町
岡山県, 神戸市西区右京町
熊本県, 浅口市富吉
北海道, 久米郡美咲町鷺浦町向田野浦
島根県, 稲敷郡河内町麻生
広島県, 人吉市上郷町来内
栃木県, 吉川市箕輪
千葉県, 坂井市稲木町
沖縄県, 加茂郡七宗町御坊山
鹿児島県, 八頭郡若桜町草深
和歌山県, 吉野郡野迫川村前崎西町
千葉県, 横浜市青葉区神出町小束野
東京都, 伊都郡高野町高清水上佐野
新潟県, 摂津市寄木町秋葉
山梨県, 上北郡六ヶ所村児島小川
広島県, 岩手郡岩手町久保田町江戸
石川県, 塩竈市モエレ沼公園
奈良県, 邑智郡川本町上余戸
大阪府, 比企郡鳩山町楯山
埼玉県, 仙台市若林区西二又町
秋田県, 南佐久郡佐久穂町安土町宮津
福井県, 青森市吉美
三重県, 伊丹市箕輪町
宮城県, 尾張旭市楯山
和歌山県, 日立市西軽部
秋田県, 上磯郡木古内町太秦安井藤ノ木町
山梨県, 中新川郡舟橋村引佐町栃窪
群馬県, 新潟市西蒲区赤橋
奈良県, 甲斐市成子町
高知県, 泉北郡忠岡町中町
長崎県, 泉佐野市吉川区泉
奈良県, 黒川郡大衡村鹿勝川町
島根県, 甘楽郡下仁田町旭天神町
埼玉県, 利尻郡利尻富士町三間町則
佐賀県, 足柄下郡真鶴町高砂町
京都府, 那須塩原市三輪
新潟県, 上益城郡山都町寄木町秋葉
静岡県, 流山市河原市
埼玉県, 恵那市寄近町
愛媛県, 羽咋郡宝達志水町南新町
三重県, 南アルプス市井内
千葉県, 熊毛郡上関町赤橋
山梨県, 東かがわ市新浦島町
石川県, 宿毛市東立神町
奈良県, 芳賀郡芳賀町三口町
宮崎県, 大竹市吉舎町敷地
新潟県, 浦河郡浦河町北中
長崎県, 檜山郡厚沢部町白根日の出町
奈良県, 札幌市豊平区新浜町
沖縄県, 上浮穴郡久万高原町東隈
奈良県, 有珠郡壮瞥町深草石橋町
福井県, 伊勢崎市瑞穂町西郷丙
徳島県, 沼田市永福町
大分県, 交野市深草森吉町
東京都, 京都郡苅田町志徳
兵庫県, 南陽市下野上
群馬県, 天草市館山上扇田
秋田県, 宇城市丸山町
香川県, 三重郡菰野町七日町
滋賀県, 南都留郡西桂町中子
群馬県, 西村山郡河北町佐方
熊本県, 大田区福岡中央
福島県, 菊川市山城町末貞
茨城県, 北安曇郡小谷村木伏
栃木県, 甘楽郡下仁田町花尻ききょう町
福島県, 熊毛郡田布施町桧岱
長野県, 糟屋郡篠栗町田越
京都府, 萩市磯浜町
愛知県, 中魚沼郡津南町太海西
岐阜県, 球磨郡湯前町二俣
香川県, 常陸大宮市温泉
群馬県, 大船渡市高山町
山形県, 三重郡川越町富田町春田
千葉県, 北斗市園原
埼玉県, 上北郡東北町杷木星丸
大阪府, 下田市大西町宮脇
大阪府, 西伯郡日吉津村東間上町
東京都, 岡山市東区土師町
長崎県, さいたま市岩槻区京町
佐賀県, 島尻郡南大東村伏木古府元町
岡山県, 高浜市網干区田井
滋賀県, 美方郡香美町上熊本
長野県, 大島郡大和村十日町
山梨県, 豊田市仁江町
福島県, 結城市長沼
兵庫県, 京都市右京区苗振谷地
徳島県, 三沢市三国町竹松
宮城県, 糸島市市野々
新潟県, 高知市日乃出町
岡山県, 川崎市宮前区安慶田
大阪府, 行橋市西村町
愛媛県, 大阪市鶴見区今市
愛知県, 福岡市東区八塩
広島県, 川崎市幸区宇久須
福島県, 上益城郡御船町浜谷町
福岡県, 球磨郡湯前町樟陽台
和歌山県, 袖ケ浦市稲荷町
和歌山県, 小平市和泉
兵庫県, 近江八幡市八木間町
宮崎県, 遠賀郡遠賀町勝部
香川県, 養父市西方町金井
岩手県, 夷隅郡御宿町西条町西条東
愛知県, 袋井市奔渡
埼玉県, 小樽市岩屋
佐賀県, 御蔵島村新シ町
京都府, 下新川郡入善町加子母
栃木県, 塩谷郡高根沢町花園町
奈良県, 八頭郡智頭町東馬寄
三重県, 北区八百屋町
秋田県, 登別市陰平町
佐賀県, 米沢市小高区上町
東京都, 二戸市本渡町本渡
愛知県, 神崎郡福崎町木落
神奈川県, 北葛城郡河合町八千代町勝田
奈良県, 古賀市大淀南
埼玉県, 東近江市鵜の森町
長野県, 牛久市大助
愛知県, 隠岐郡海士町高松町
静岡県, 広島市佐伯区御札部
鳥取県, 中郡二宮町白鳥町
神奈川県, 伊達市鹿校通
神奈川県, 大館市加子母
福岡県, 柴田郡柴田町大本
秋田県, 桑名郡木曽岬町来住町
山口県, 神崎郡神河町祇園原町
石川県, 中野市天神
広島県, 稲敷郡美浦村日和山下
埼玉県, 知多郡東浦町宿原
茨城県, 西村山郡河北町美濃池町
岩手県, 桜川市西公文名
愛知県, 志木市極楽寺
広島県, 上伊那郡箕輪町新川
高知県, 枕崎市尾崎丁
新潟県, 児玉郡上里町上黒瀬
福岡県, 木曽郡大桑村城北町
富山県, 津市田代
和歌山県, 室戸市下日出谷西
東京都, 志木市茗荷沢新田
石川県, 横浜市磯子区南方
沖縄県, 城陽市光町
広島県, 夕張郡長沼町口和町大月
長野県, 西春日井郡豊山町小畠
大阪府, 三浦市菜園場
三重県, 熊本市北区古町
奈良県, 耶麻郡磐梯町新浦島町
福島県, 八丈島八丈町増穂
高知県, いわき市滝谷本町
沖縄県, 南会津郡只見町水沢区大明神
広島県, えびの市八幡町
福井県, 玉野市欠之上
大分県, 世羅郡世羅町瀬峰泉谷
滋賀県, 柴田郡柴田町岩崎
広島県, 下都賀郡壬生町鉢
熊本県, 三島市浪岡北中野
栃木県, 東御市材木町
和歌山県, 横須賀市富合町硴江
愛知県, 下伊那郡喬木村平出
大分県, 大飯郡高浜町天満下川原
大阪府, 黒部市笛堂
熊本県, 茅部郡鹿部町稲毛町
滋賀県, 北葛城郡河合町富和
愛媛県, 敦賀市西美園町
高知県, 最上郡鮭川村高砂町
高知県, 壱岐市神宮町
滋賀県, 名西郡神山町西大寺新
福島県, 大洲市上新庄
熊本県, 仙北郡美郷町北迫町
北海道, 大沼郡会津美里町西落合
栃木県, 浦添市居能町
佐賀県, 根室市谷
富山県, 伊丹市小林
大阪府, 札幌市北区深草森吉町
沖縄県, 中津軽郡西目屋村和泉
栃木県, 中郡大磯町名田庄奥坂本
富山県, 西白河郡泉崎村須々木
愛知県, 上北郡六戸町谷原
福島県, 玖珂郡和木町古賀志町
新潟県, 磯城郡田原本町須々木
佐賀県, 南宇和郡愛南町鵜飼年毛
宮崎県, 熊本市中央区天王下
鳥取県, 藤津郡太良町右京町
滋賀県, 有田郡有田川町只野
岐阜県, 中津市羽坂
宮崎県, 名寄市ダイハツ町
茨城県, 加茂郡坂祝町桜川町
沖縄県, 三条市平佛供田町
京都府, 邑智郡美郷町螺湾
岩手県, 恵那市沢口
奈良県, 西臼杵郡高千穂町小折東町旭
宮崎県, ひたちなか市正福寺
長崎県, 中新川郡立山町吉井町池
徳島県, 多野郡神流町問屋町
宮崎県, 名古屋市守山区氷上町絹山
神奈川県, 中津軽郡西目屋村長田
石川県, 石垣市中新
福井県, 西海市栄町
東京都, 栃木市草積町
新潟県, 富岡市蔵本新
香川県, 比企郡鳩山町越ケ谷本町
愛知県, 大田原市明和通
岐阜県, 安芸市土生
鹿児島県, 大島郡徳之島町新旭町
愛媛県, 真庭市十日町
宮城県, 白井市清水村松地先新田
高知県, 児玉郡神川町下曽根
岐阜県, 能代市曽根
宮崎県, 平戸市養父元町
熊本県, 邑智郡美郷町沢口
愛知県, 品川区上三俣
新潟県, 寒河江市永福町
沖縄県, 白井市箕輪新田
長野県, 牡鹿郡女川町藤助新田
山梨県, 松本市野津町前河内
栃木県, 天塩郡遠別町木山
広島県, 鹿島郡中能登町上谷新田
大分県, 上尾市須玖北
大分県, 西伯郡伯耆町藤塚
長野県, 真庭郡新庄村本吉町深萩
新潟県, 児玉郡美里町貝少
岐阜県, 北安曇郡小谷村上奈良東ノ口
福井県, 大野市養父元町
埼玉県, 名西郡神山町坂井町若宮
岡山県, 美作市高松町
宮城県, 双葉郡楢葉町春日川中
新潟県, 幡多郡黒潮町城新田
東京都, 鴻巣市宇品神田
愛媛県, 大島郡宇検村大瀬戸町雪浦久良木郷
茨城県, 由利本荘市水元町
岐阜県, 新潟市江南区吾妻橋
栃木県, 渋川市松ケ崎東桜木町
徳島県, 香南市奈摩郷
神奈川県, 最上郡金山町熨斗戸
群馬県, 猿島郡五霞町沓掛
鹿児島県, 豊前市村高町
秋田県, 虻田郡京極町西ノ京笠殿町
京都府, 東伯郡北栄町日和山下
福島県, 伊予市落合
岡山県, 日高郡新ひだか町梨ケ原
栃木県, 越前市川島田
和歌山県, 札幌市南区蛭谷
長崎県, 東松島市上熊野
三重県, 三笠市新磯子町
鹿児島県, 小金井市福瀬町
大阪府, 寒河江市貝皿
徳島県, 大阪市天王寺区上西之門町
長崎県, 美濃市神指町如来堂
千葉県, 荒尾市国見町鬼籠
石川県, 綴喜郡宇治田原町山崎
石川県, 九戸郡野田村御船蔵町
大分県, 庄原市小池
石川県, 石狩郡当別町周防町
島根県, 大野城市上川路
岐阜県, 船井郡京丹波町志々見町
青森県, 名古屋市守山区岡部町青羽根
熊本県, 大洲市藤河内
鳥取県, さいたま市浦和区安行藤八
宮崎県, 葦北郡芦北町丸島町
埼玉県, 上伊那郡辰野町美星町烏頭
青森県, 本庄市池田町川崎
福岡県, 苫前郡初山別村芹中町
島根県, 加東市大瀬東
秋田県, 宗谷郡猿払村柳原町
兵庫県, 河西郡更別村龍岡町下條南割
山形県, 隠岐郡知夫村下鴨高木町
和歌山県, 隠岐郡知夫村元学町
静岡県, 相模原市中央区桜馬場町
長野県, 山本郡三種町新先斗町
新潟県, 名古屋市昭和区竹鼻竹ノ街道町
佐賀県, 橿原市玉城船越
埼玉県, 宇和島市甲徳兵衛町
岩手県, 釧路市前崎西町
香川県, 糟屋郡宇美町松尾
長野県, 登米市杷木星丸
秋田県, 天塩郡幌延町稲木町
高知県, 加茂郡白川町南方町下新山
大分県, 虻田郡ニセコ町新山梨
熊本県, 守口市砂金町
奈良県, 川辺郡猪名川町松山
岐阜県, 杵築市都賀本郷
山形県, 郡山市今里
岡山県, 杵島郡白石町上熊野
鹿児島県, 沖縄市赤坂
茨城県, 潟上市栄生町
秋田県, 東牟婁郡串本町日和山下
石川県, 久米郡美咲町川口町
岡山県, 富士宮市池内
高知県, 東田川郡庄内町久米
新潟県, 西春日井郡豊山町弓越
山梨県, 加賀郡吉備中央町浪速
香川県, 西津軽郡深浦町小島田町
愛媛県, 安八郡神戸町小折東町旭
沖縄県, 小郡市磯部
宮城県, 南巨摩郡富士川町岡部町青羽根
東京都, 向日市桜町
山梨県, 上北郡野辺地町衣笠町
東京都, 古河市宮津口
東京都, 相楽郡南山城村春日川中
愛媛県, 入間郡三芳町池田町川崎
兵庫県, 伊佐市黒坂町
神奈川県, 鳳珠郡穴水町箕輪
広島県, 長岡郡大豊町御田
栃木県, 中央区猫沢
新潟県, 大野郡白川村下梨
岐阜県, 賀茂郡西伊豆町西山町五日市
新潟県, 知多郡東浦町金町
熊本県, 葛飾区今岡町
秋田県, 中郡大磯町秋山
神奈川県, 猿島郡五霞町東野町西神田
徳島県, 柴田郡川崎町麻生
山形県, 川崎市麻生区草積町
熊本県, 増毛郡増毛町赤橋
茨城県, 吾妻郡高山村上新庄
佐賀県, 鹿嶋市成田
山口県, 瑞浪市岡部町青羽根
秋田県, 新宿区寺中町
三重県, 札幌市西区八島町
静岡県, 竹田市豊町
茨城県, 長岡郡本山町指扇領辻
群馬県, 小林市尾崎丁
山口県, 新潟市南区松尾
愛媛県, 柴田郡柴田町喰代
青森県, 大沼郡昭和村岩屋
鳥取県, 台東区新シ町
石川県, 韮崎市芥田
千葉県, 東茨城郡茨城町箕輪
石川県, 利根郡片品村留辺蘂町金華
秋田県, 大和郡山市蛭子町
石川県, 藤井寺市母子
福井県, 神戸市東灘区八角町
岐阜県, 空知郡南富良野町西町
香川県, 三重郡菰野町瀬峰泉谷
鹿児島県, 須崎市宇治町宇治
兵庫県, 交野市飯沢
新潟県, あわら市北七区
山形県, 大島郡徳之島町松崎馬場
富山県, 横浜市栄区箕輪町
群馬県, 京都市上京区京町
宮城県, 香川郡直島町矢野口
宮城県, 浜松市西区久保田町江戸
岩手県, 弥富市芝之町
大阪府, 双葉郡楢葉町大森町堂林
栃木県, 熊本市中央区モエレ沼公園
高知県, 神崎郡神河町佐久間町大井
岐阜県, 刈田郡七ヶ宿町田井
神奈川県, 玖珠郡九重町八森樋長
大分県, 船橋市祝子町
沖縄県, 牧之原市大矢知新町
兵庫県, 肝属郡東串良町悪石島
和歌山県, 河東郡士幌町松崎馬場
山口県, 木曽郡大桑村尾崎丁
福岡県, 南都留郡山中湖村八幡町
岐阜県, 赤磐市西が迫
群馬県, 室蘭市国分北
岩手県, 吉野郡天川村渡内
石川県, 海草郡紀美野町内馬場町
石川県, 新潟市西区矢田
山口県, 福井市田越
熊本県, 樺戸郡月形町五畳敷
富山県, 秦野市宇治町
和歌山県, 西津軽郡鰺ヶ沢町相川羽田町
山形県, 度会郡度会町東川
徳島県, 国分寺市大久保
大分県, 福島市麻生
秋田県, 羽村市別府
徳島県, 香取市奔渡
徳島県, 泉南郡田尻町波多津町津留主屋
奈良県, 大津市居倉町
香川県, 天塩郡幌延町魚町
埼玉県, 相楽郡南山城村桃山町伊賀
長野県, 朝霞市幸町
秋田県, 岩出市松尾町借毛本郷
広島県, 小諸市平山崎
岩手県, 滝川市清尾
福岡県, 新発田市日和田町
高知県, 吾川郡いの町大戸町石村
長野県, 南牟婁郡紀宝町廿五里
山口県, 虻田郡豊浦町三ツ矢橋
愛媛県, 今治市船町
千葉県, 西村山郡大江町山都町沢尻
千葉県, 坂東市神谷丙
北海道, 佐賀市田宮本町
愛媛県, 北松浦郡佐々町西町
東京都, 郡上市西落合
和歌山県, 紋別市象潟町続島
熊本県, 児湯郡川南町高砂町
栃木県, 白岡市上対馬町五根緒
山梨県, 中川郡中川町沢松
千葉県, 上川郡比布町正福寺
広島県, 檜山郡江差町西落合
愛媛県, 浜松市西区西二又町
滋賀県, 亀岡市酪陽
福井県, 品川区十日町
群馬県, 羽咋郡宝達志水町上三俣
山形県, 大和郡山市赤城町
岐阜県, 港区阪田
沖縄県, 雨竜郡妹背牛町南崩山町
奈良県, 下呂市上組郷
福岡県, 鹿島市西条町西条東
群馬県, 久慈市稲荷町
長野県, 中川郡音威子府村正木町新井
秋田県, 福津市上組郷
鳥取県, 福知山市鳥羽
