佐賀県, 瑞浪市黒坂町
大阪府, 上水内郡信濃町二ノ平
三重県, 中津川市木津屋町
岩手県, 河北郡津幡町高山町
島根県, さいたま市西区中津川
青森県, 上川郡上川町昭和町
栃木県, 安城市八尾町井田
静岡県, 小金井市市振
福岡県, 最上郡金山町三重
宮崎県, 枝幸郡浜頓別町福田
福島県, 富里市殿城
愛知県, 北九州市若松区箕輪町
和歌山県, 綾歌郡綾川町東勝原
青森県, 大阪市東成区新保町
宮城県, 日高郡由良町山王臨海町
大分県, 大飯郡高浜町右京町
徳島県, 加茂郡白川町市野々
栃木県, 館山市桜町
京都府, 益田市須々木
沖縄県, 焼津市下野上
岡山県, 球磨郡五木村下津町笠畑
石川県, 三島郡島本町八幡町
神奈川県, 横浜市栄区甲賀町毛枚
佐賀県, 岡山市東区芙蓉
岡山県, 広島市西区芦垣
奈良県, 榛原郡吉田町松尾
埼玉県, 西之表市更木
鳥取県, 西村山郡大江町栄町
群馬県, 河西郡中札内村波多津町津留主屋
長崎県, 雨竜郡幌加内町須木奈佐木
沖縄県, 遠賀郡水巻町所谷町
新潟県, 狭山市中
熊本県, 三田市新町
和歌山県, 増毛郡増毛町烏出川
鹿児島県, 河沼郡湯川村徳山
京都府, 下伊那郡大鹿村岩崎西
千葉県, 北葛飾郡松伏町八木
和歌山県, 葛飾区潮見台
大阪府, 大月市芙蓉
大阪府, 大和郡山市並木
福岡県, 下水内郡栄村坂下新田
山梨県, 札幌市厚別区東勝原
宮崎県, 豊後高田市高坂
埼玉県, 福岡市中央区竹野町浜須井
岩手県, 養老郡養老町小林
福島県, 行橋市逆面町
愛知県, 松原市木落
福岡県, 安芸市八雲町東岩坂
千葉県, 河北郡内灘町天王下
神奈川県, 下新川郡朝日町衣川区天土
和歌山県, 樺戸郡月形町弓削日比
大分県, 天塩郡遠別町多田院西
千葉県, 糸島市弓削日比
山口県, 安八郡神戸町旭天神町
兵庫県, 大阪市西淀川区引佐町栃窪
徳島県, 苫小牧市右京町
愛媛県, あま市井岡
高知県, 対馬市大瀬東
宮崎県, 下伊那郡松川町西京極東衣手町
静岡県, 串間市神宮町
徳島県, 西之表市上奈良東ノ口
山口県, むつ市多度町御衣野
兵庫県, 神埼市谷
神奈川県, 大島町笛堂
長野県, あわら市豊岡
愛知県, 夷隅郡大多喜町亀崎
岐阜県, 筑紫野市春山町
富山県, 宗像市芹中町
熊本県, 足柄下郡真鶴町悪石島
鳥取県, 我孫子市上川路
富山県, 唐津市南新町
静岡県, 堺市堺区岩作隅田
東京都, 国頭郡東村坪山
兵庫県, 国頭郡東村陰平町
佐賀県, 貝塚市上熊本
神奈川県, 大洲市神田佐久間河岸
千葉県, 西彼杵郡時津町大淀南
愛知県, 岡山市南区旭天神町
新潟県, 志布志市宮津口
福岡県, 可児郡御嵩町北原東
神奈川県, 加賀郡吉備中央町田所町
島根県, 丸亀市祢津
茨城県, 狭山市原町田
新潟県, 豊前市高新田
大阪府, 邑智郡川本町米山町愛宕前
長野県, 伊万里市西公文名
島根県, 檜山郡江差町松尾町借毛本郷
熊本県, 隠岐郡海士町宮野下
熊本県, 刈田郡七ヶ宿町五輪原
神奈川県, 平戸市天神
岡山県, 水戸市豊里町長根浦
岐阜県, 西津軽郡深浦町古賀志町
愛媛県, 射水市住吉町
福井県, 笠岡市京北柏原町
鳥取県, 印旛郡栄町江上町
福岡県, 札幌市中央区岸城町
滋賀県, 高砂市竹下
千葉県, 安芸郡芸西村葛川
静岡県, 余市郡仁木町兎内上保土沢
福岡県, 下伊那郡泰阜村龍岡町下條南割
福井県, 古河市西改田松の木
福島県, さいたま市桜区唐松春光町
徳島県, 安芸郡奈半利町高坂
大阪府, 広尾郡大樹町桜町
山口県, 姶良市茗荷沢新田
島根県, 東牟婁郡古座川町沢松
島根県, 茂原市立石
茨城県, 生駒郡斑鳩町舘野
岩手県, 武蔵村山市船町
奈良県, 栃木市西上
新潟県, 国頭郡東村和田町
滋賀県, 加茂郡白川町大町
千葉県, 多野郡上野村奔渡
愛知県, 富田林市三ツ矢橋
神奈川県, 合志市竹町
静岡県, 大島郡天城町寒昇
三重県, 吉野郡川上村直島町一円
福井県, 大阪市大正区樫原分田
長崎県, 大阪市西淀川区笹曽根町
岐阜県, 千葉市若葉区指扇領辻
宮城県, 埴科郡坂城町出雲
京都府, 太田市有楽町
京都府, 足柄下郡箱根町塚原新田
和歌山県, 豊能郡能勢町杷木星丸
沖縄県, 北設楽郡豊根村居倉町
長野県, 米沢市三輪
長野県, 霧島市兎内上保土沢
滋賀県, 東津軽郡平内町芸濃町中縄
滋賀県, 板野郡松茂町前崎西町
福島県, 厚岸郡浜中町笛堂
岐阜県, 那須塩原市南美唄町上
岡山県, 上伊那郡箕輪町雲ケ畑出谷町
北海道, 南秋田郡五城目町立川町
山梨県, 多野郡神流町東沢田
福岡県, 今立郡池田町芥田
大分県, 草津市中島町
茨城県, 守山市清尾
愛知県, 鳳珠郡能登町久保町
兵庫県, 竹原市長瀬
広島県, 鉾田市柿崎区城腰
愛媛県, 北相馬郡利根町宮ノ入
青森県, 杵島郡白石町小島田町
滋賀県, 京都市山科区府屋
鹿児島県, 丹波篠山市西飛山
福島県, 枕崎市黒木町北大淵
鳥取県, 守山市潮見台
沖縄県, 糟屋郡篠栗町童仙房
愛媛県, 泉大津市正木町新井
富山県, 安曇野市山都町沢尻
北海道, 近江八幡市山川町矢落
山梨県, 亀山市仁井田
高知県, 山辺郡山添村成田
富山県, 綾部市員弁町平古
広島県, 南都留郡山中湖村白山
秋田県, 日高郡新ひだか町十日町
宮城県, 京都市左京区宮ノ入
沖縄県, 埴科郡坂城町甲徳兵衛町
福島県, 羽島郡岐南町薬師堂町
岡山県, 有田市久野本
神奈川県, 邑智郡美郷町灘
広島県, 名寄市北村栄町
岐阜県, 東海市神指町如来堂
熊本県, 小田郡矢掛町美川町四馬神
東京都, 益田市平和町
福井県, 平戸市高瀬町上麻
和歌山県, 北蒲原郡聖籠町黒木町北大淵
島根県, 加美郡色麻町青海川
香川県, 九戸郡九戸村小松原
佐賀県, 笛吹市昭和町
佐賀県, 遠賀郡芦屋町幸町
富山県, 大里郡寄居町北町
東京都, 泉南郡田尻町宝来
和歌山県, 坂井市坂田
埼玉県, 瀬棚郡今金町烏出川
新潟県, 田方郡函南町上対馬町五根緒
岐阜県, 会津若松市八幡崎本宮
宮城県, 蒲郡市本燈籠町
福岡県, 神埼市常盤町
京都府, 伊豆の国市殿城
東京都, 北区海瀬
富山県, 東白川郡塙町中央通
秋田県, 中頭郡西原町湯来町多田
秋田県, 豊田市沢口
佐賀県, 佐野市舞崎町
富山県, 北広島市逆面町
岡山県, 多気郡多気町深草石橋町
長崎県, 秋田市北太田
佐賀県, 香取郡神崎町西ノ京笠殿町
大阪府, 豊前市中町
愛知県, 神戸市東灘区田井
沖縄県, 知多郡東浦町深堀
北海道, 日高郡美浜町久場
徳島県, 御坊市あのつ台
沖縄県, 久留米市永福町
京都府, 久遠郡せたな町三口町
新潟県, 南秋田郡井川町古川町
島根県, 海部郡蟹江町久美浜町葛野
富山県, 南都留郡道志村宇久町飯良
福岡県, 神戸市中央区下大川前通
鳥取県, 大分市奈川
鹿児島県, 対馬市森戸
山梨県, ふじみ野市神田佐久間河岸
埼玉県, 北斗市草安
愛媛県, 七尾市磯浜町
長崎県, 浜松市南区新堀新田
鳥取県, 球磨郡あさぎり町元町
三重県, 赤穂市八木間町
愛媛県, 天塩郡豊富町難波千日前
石川県, 加古川市東間上町
長野県, 北都留郡丹波山村楯山
山形県, 網走郡大空町上熊本
富山県, 賀茂郡松崎町彦島
岩手県, 北九州市戸畑区児島小川
栃木県, 浜松市中区蔵本新
福井県, 三浦市港町
鳥取県, 砺波市大堀
奈良県, 燕市東大島
京都府, 羽咋市西上
岩手県, 北葛城郡上牧町坂本
鳥取県, 合志市東金屋
奈良県, 飯塚市天神新
石川県, 双葉郡双葉町谷田
広島県, 河内長野市宮ノ入
鳥取県, 高岡郡日高村成子町
富山県, 小松市池寺
茨城県, 五所川原市三川
石川県, 大阪市東住吉区堀内
埼玉県, 京都市山科区伊呉野
兵庫県, 揖斐郡大野町柳町
千葉県, 仙台市宮城野区桜
長野県, 神戸市長田区山田町
愛媛県, 西予市山王町
山形県, 釜石市祝子町
宮城県, 横浜市神奈川区金屋谷
広島県, 田川市波多津町津留主屋
富山県, 東伯郡湯梨浜町上丹生
徳島県, 上北郡おいらせ町大雄東中島
大分県, 東置賜郡川西町相島
福島県, 大野市松山
茨城県, 寿都郡黒松内町弁天
島根県, 名古屋市中区箕輪
岡山県, 佐賀市上組郷
沖縄県, 員弁郡東員町花勝山
東京都, 横浜市鶴見区下新田
山口県, 河沼郡湯川村川口町
奈良県, 京都市中京区経田西町
高知県, 八千代市新上条
愛媛県, 九戸郡軽米町園原
三重県, 箕面市けやき台
沖縄県, 知多市赤浜栄町
東京都, 伊那市指扇領辻
京都府, 河沼郡会津坂下町島原町
埼玉県, 磯谷郡蘭越町麻生
福島県, 黒川郡大衡村塩屋
島根県, 三戸郡田子町対雁
三重県, 酒田市藤井町
栃木県, 北佐久郡軽井沢町太子堂
岐阜県, 大府市箕輪
石川県, 熊毛郡南種子町宇久須
山口県, 恵庭市木伏
福井県, 京都市伏見区小谷美濃山町
福島県, 静岡市清水区子安町
北海道, 神戸市西区内馬場町
栃木県, 邑智郡川本町大津通
鹿児島県, 中津市松山
福島県, 西白河郡矢吹町和見町
千葉県, 古宇郡神恵内村淀本町
福井県, 船橋市八塩
埼玉県, 石川郡平田村東上秋間
広島県, 吉野郡川上村彦島
広島県, 高崎市八百屋町
和歌山県, 南佐久郡南牧村下川上
石川県, 島尻郡粟国村大堀
島根県, 日向市石垣町西側
大分県, 飯塚市東原町
北海道, うきは市長田
島根県, 日高市北迫町
岩手県, 牡鹿郡女川町鈴が峰町
福岡県, 東松浦郡玄海町新旭町
岡山県, 印旛郡栄町丸山町
新潟県, 相馬郡新地町本郷町
香川県, 蒲生郡日野町南美唄町上
東京都, 草加市花園町
新潟県, 串間市三口町
福岡県, 合志市滝本
富山県, 新潟市西区西七条中野町
新潟県, 白山市本宮町
岐阜県, 鹿島郡中能登町天神新
千葉県, 横浜市泉区鹿立
徳島県, 上川郡比布町江上町
石川県, 西八代郡市川三郷町清川
長崎県, 稲敷郡阿見町上溝
神奈川県, 秩父郡皆野町上磯分内
岐阜県, 南房総市船町
山口県, 古賀市覚王寺
山口県, 下伊那郡天龍村浦川原区上柿野
新潟県, 北広島市和良町宮地
愛知県, 安芸郡奈半利町富和
長野県, 沙流郡日高町モエレ沼公園
埼玉県, 岡崎市黒坂町
大分県, 東彼杵郡川棚町太子堂
島根県, 下高井郡山ノ内町円山町
秋田県, 下北郡大間町難波千日前
福岡県, 明石市邑久町上山田
長野県, 笛吹市徳山
神奈川県, 双葉郡浪江町下平川
山形県, 府中市池寺
埼玉県, 柴田郡柴田町中畑町
福井県, 球磨郡水上村赤橋
山梨県, 神戸市長田区草積町
静岡県, 福岡市東区栄町
岐阜県, 木曽郡木曽町宇目河内
宮崎県, 八街市三川
神奈川県, 八女郡広川町丸屋町
奈良県, 田川郡川崎町西町
山口県, 遠賀郡岡垣町下鴨高木町
和歌山県, 安城市温泉
長野県, 加茂郡八百津町常盤町
茨城県, 愛知郡東郷町西上
新潟県, 球磨郡山江村正岡神田
山梨県, 杵築市相島
北海道, 上田市坂本
秋田県, 氷見市佐田町八幡原
宮城県, 新潟市南区浄法寺町飛鳥谷地
東京都, 宮城郡七ヶ浜町平野
鹿児島県, 双葉郡葛尾村山田町
東京都, 河東郡音更町日置野田
神奈川県, 芳賀郡芳賀町砂子
徳島県, 仲多度郡まんのう町石田町池田仲触
茨城県, 紋別郡西興部村宮川町小谷
兵庫県, 阿南市喜念
富山県, 木曽郡南木曽町高津
福岡県, 下都賀郡壬生町大宮町
静岡県, 神崎郡神河町小畠
岐阜県, 野洲市東九条西札辻町
奈良県, 浦河郡浦河町大瀬戸町雪浦久良木郷
熊本県, かすみがうら市向日比
三重県, 葛飾区立石
奈良県, 新冠郡新冠町岩作隅田
山口県, 駿東郡長泉町高砂町
徳島県, 善通寺市湯来町多田
愛知県, 遠田郡涌谷町仁江町
埼玉県, 武蔵野市箕輪新田
青森県, 桐生市北村栄町
栃木県, 虻田郡洞爺湖町口野
大分県, 酒田市上渋井
岡山県, 網走郡大空町大通北
愛知県, 山辺郡山添村大浜
兵庫県, 下伊那郡高森町居倉町
岐阜県, 西多摩郡瑞穂町十和田山根
和歌山県, 丹波市浜岩泉
大分県, 邑楽郡明和町館山上扇田
岡山県, 広島市中区上新庄
秋田県, 稲敷郡美浦村下津町笠畑
岐阜県, 木曽郡上松町陽光園
島根県, 横手市港町
石川県, 阿蘇郡産山村三間町則
鹿児島県, 豊中市須玖北
宮城県, 遠野市本吉町深萩
東京都, 小諸市小原西
徳島県, 与謝郡与謝野町折谷町
宮城県, 伊達郡国見町材木町
栃木県, 大阪市平野区久住町仏原
福島県, 岩国市弓越
長崎県, 海南市下日出谷西
福岡県, 東牟婁郡北山村春山町
滋賀県, 八王子市愛の杜
静岡県, 河東郡鹿追町菊水町
愛知県, 球磨郡あさぎり町八幡崎本宮
富山県, 海部郡海陽町大雄東中島
鳥取県, 匝瑳市浄法寺町樋口
佐賀県, 上川郡和寒町下鴨高木町
三重県, 四万十市徳山
高知県, 草津市大原
愛媛県, 丸亀市上磯分内
東京都, 君津市二見町
新潟県, 葦北郡津奈木町奥沢
滋賀県, 島尻郡南大東村円阿弥
滋賀県, 青ヶ島村山之作
福岡県, 小松島市藤河内
高知県, 板野郡藍住町光町
石川県, 西都市藤井町
長野県, 岸和田市米山町愛宕前
東京都, 天塩郡幌延町大浜
高知県, 東津軽郡今別町水橋下砂子坂
和歌山県, 名古屋市西区大杉
佐賀県, 横浜市戸塚区疋田
静岡県, 那須烏山市富久山町南小泉
大分県, 伊勢崎市八幡崎本宮
鹿児島県, 北本市田井
熊本県, 広島市南区北太田
高知県, 鹿沼市松ケ崎東桜木町
静岡県, 三沢市高山
新潟県, 島田市上田の口
青森県, 中魚沼郡津南町三木里町
長崎県, 入間郡越生町尾崎丁
兵庫県, 野々市市磯部
島根県, 那賀郡那賀町御津町金野袋田
愛知県, 安房郡鋸南町野津町前河内
山口県, 海老名市下曽根
群馬県, 上川郡上川町久美浜町葛野
京都府, 南あわじ市永穂
茨城県, 鹿嶋市小栗栖石川町
栃木県, 幸手市外目
島根県, 佐世保市宍道町白石
岩手県, 八頭郡若桜町志々見町
山梨県, 大川市福岡中央
新潟県, 甲斐市城島町芦塚
宮城県, 曽於郡大崎町正岡神田
三重県, 上北郡六ヶ所村今岡町
岩手県, 吉野郡上北山村石上
香川県, 加茂郡川辺町鵜の森町
埼玉県, 角田市木曽川町内割田
青森県, 横浜市神奈川区出合
長野県, 岩沼市京町
熊本県, 江別市旭天神町
愛知県, 南巨摩郡南部町貝皿
長野県, 広島市安佐北区仲原
鹿児島県, 帯広市長沼
茨城県, 大阪狭山市正福寺
徳島県, 五島市八角町
奈良県, 函館市湯来町多田
山口県, 笛吹市宇治町宇治
岡山県, 苫小牧市長府新松原町
岩手県, 東国東郡姫島村成田
福島県, 東牟婁郡串本町旭町
岡山県, 南会津郡南会津町力昼
愛知県, 下伊那郡高森町潮見台
大分県, 邑智郡邑南町扇町
滋賀県, 磯谷郡蘭越町高瀬町上麻
秋田県, 松浦市播磨町
熊本県, 臼杵市東大島
茨城県, 浦添市象潟町続島
秋田県, 南佐久郡南相木村岩崎西
山口県, 大飯郡高浜町中野
東京都, 多気郡多気町城新田
静岡県, 吉野郡吉野町杷木星丸
長野県, 札幌市北区京北柏原町
滋賀県, 邑楽郡千代田町石上
大分県, 坂東市幡生町
奈良県, 西村山郡大江町潮見台
石川県, 下閉伊郡山田町薫る坂
鳥取県, 上川郡比布町落合
富山県, 知立市畑中
長崎県, 紀の川市梨ケ原
東京都, 妙高市山崎
富山県, 習志野市三川
長崎県, 御殿場市前崎西町
福井県, 仙台市若林区宿原
鳥取県, 南条郡南越前町小池
茨城県, 生駒市浦川原区上柿野
兵庫県, つくば市宮野下
福井県, 芳賀郡市貝町宇久須
秋田県, 磯城郡三宅町古屋敷町
宮城県, 四街道市日乃出町
長崎県, 平塚市京町
三重県, 中野市西村町
長野県, 茅部郡森町二本木
鹿児島県, 真庭市西大寿台
山形県, 大飯郡高浜町砂子
北海道, 安来市岩名
茨城県, 天塩郡天塩町柏木町
栃木県, 空知郡奈井江町北町
熊本県, 田川郡福智町大和
千葉県, 東彼杵郡川棚町儀間
栃木県, いなべ市加茂町南大門
大阪府, 中津市井内
香川県, 美馬市つくも町
島根県, 五島市上高野畑町
熊本県, 彦根市清尾
三重県, 金沢市上野新
香川県, 小千谷市城所
愛媛県, 東白川郡棚倉町右京町
福岡県, 春日部市西町
岩手県, 遠賀郡遠賀町二俣
静岡県, 南会津郡檜枝岐村麻生
高知県, 西之表市福貴
京都府, 相馬市三和町辻
岩手県, 加古郡播磨町五色町鮎原小山田
京都府, 蓮田市中
宮城県, 東大阪市東間上町
山梨県, 橿原市江丹別町富原
長野県, 浦添市駒木台
沖縄県, 高山市今里
兵庫県, 東かがわ市芦垣
広島県, むつ市五郎
島根県, 日高郡美浜町伊保崎
福島県, 国頭郡国頭村美川町四馬神
福島県, 二海郡八雲町柿
福島県, 下松市辻
大阪府, 熊本市北区学園赤松町
埼玉県, 高岡郡越知町中通
北海道, 神戸市灘区高倉町
富山県, 菊川市桜町
香川県, 足柄上郡大井町大町
和歌山県, 羽島郡笠松町小畠
青森県, 津島市赤野乙
岩手県, 名古屋市中川区光町
山口県, 南牟婁郡紀宝町牧
奈良県, 札幌市厚別区桜
青森県, 横浜市港南区大橋
岡山県, 雨竜郡沼田町牛込
沖縄県, 古賀市日乃出町
沖縄県, 新島村高坂
長野県, 神埼市仁井田潟中町
東京都, 東茨城郡城里町神宮町
徳島県, 横須賀市童仙房
三重県, 大飯郡高浜町山方町
宮城県, 御所市花丘町
新潟県, 総社市北太田
秋田県, 生駒郡安堵町元学町
埼玉県, 浦河郡浦河町二本木
和歌山県, 仙台市若林区二見町
高知県, 仙台市青葉区高新田
和歌山県, 八幡浜市駒ケ谷
東京都, 松浦市牧区泉
愛知県, 紫波郡紫波町西ノ京町
岩手県, 東大和市仁井田
愛知県, 枝幸郡中頓別町満願寺
徳島県, 古河市井岡
福井県, 井原市美川末広町
兵庫県, 天童市永井町
宮城県, 上川郡東川町久々宇
岩手県, 鹿足郡吉賀町大町
長野県, 川辺郡猪名川町山都町沢尻
岩手県, 今立郡池田町唐松春光町
秋田県, 比企郡鳩山町一色町
茨城県, 肝属郡南大隅町仁川高台
福岡県, 東白川郡塙町五畳敷
千葉県, 板野郡上板町天満下川原
和歌山県, 富士宮市船町
山梨県, 旭川市矢野口
北海道, 上北郡横浜町調川町平尾免
群馬県, 国東市東山田
京都府, 国頭郡恩納村寺沢前
滋賀県, 余市郡赤井川村松島町
福島県, 築上郡上毛町豊原
熊本県, 福岡市東区今市
奈良県, 豊中市志徳
香川県, 高島市上渋井
東京都, 多気郡明和町上宇野令
島根県, 西磐井郡平泉町佐々羅
愛媛県, 能代市栄町
山梨県, 御殿場市中
富山県, 河北郡内灘町増穂
静岡県, 東大阪市伊保崎
滋賀県, 那覇市上川路
山形県, 高岡市松街道
岡山県, 広島市安芸区亀崎
兵庫県, 相模原市中央区福貴
東京都, 朝来市鳥羽
富山県, 隠岐郡西ノ島町鹿島台船越
栃木県, 那須塩原市別府
山口県, 御坊市高畑町
山口県, 豊能郡能勢町久居藤ケ丘町
福島県, 広島市佐伯区船町
長野県, 幡多郡大月町白鳥町中津屋
新潟県, 東白川郡矢祭町磯浜町
徳島県, 比企郡川島町篠原東
滋賀県, 下伊那郡売木村東灘
茨城県, 陸前高田市碁点
山口県, 上川郡鷹栖町波多津町津留主屋
栃木県, 積丹郡積丹町安浦町赤向坂
和歌山県, 尾鷲市榛原澤
岡山県, 島田市山川町矢落
三重県, 恵庭市大橋
長崎県, 大洲市東九条西札辻町
山梨県, 西村山郡大江町南倉沢
富山県, 山形市台ケ窪
新潟県, 志布志市安行藤八
徳島県, 夕張郡長沼町五十嵐
宮城県, 春日部市東本宿
東京都, 北津軽郡板柳町飯
山梨県, 西牟婁郡上富田町神野町西条
富山県, 奈良市川島渡町
広島県, 函館市大町
秋田県, 足柄下郡箱根町西大寿台
島根県, 三方郡美浜町塚原新田
宮城県, 古平郡古平町八幡町
東京都, 稲城市村高町
和歌山県, 明石市西矢島町
徳島県, 球磨郡球磨村神出町小束野
兵庫県, 駿東郡長泉町下鴨高木町
岐阜県, 姶良郡湧水町鹿勝川町
山形県, 加茂郡坂祝町西京極東衣手町
広島県, 交野市三和区川浦
徳島県, 東臼杵郡門川町篠原東
千葉県, 安芸郡坂町池下裏
東京都, 旭川市前平町
静岡県, 白糠郡白糠町岩屋
青森県, 富里市天神
埼玉県, 小矢部市蛸井興屋
岐阜県, 最上郡最上町宇治町宇治
秋田県, 綾瀬市四日町
東京都, 東臼杵郡諸塚村下荒又
静岡県, 北相馬郡利根町下津町笠畑
新潟県, 長浜市弓越
佐賀県, 上水内郡信濃町五十嵐
滋賀県, 三木市輝北町下百引
大阪府, 市川市松街道
和歌山県, 葦北郡芦北町大森町堂林
愛知県, 名古屋市南区正岡神田
沖縄県, 熊野市岩名
長野県, 八王子市童仙房
兵庫県, 北葛飾郡松伏町楯山
沖縄県, 鳥羽市大浜
兵庫県, 日進市安江町
香川県, 北松浦郡佐々町水橋下砂子坂
愛知県, 燕市南新町
埼玉県, 静岡市清水区砂子
島根県, 太田市桜ケ丘町
静岡県, 天塩郡遠別町北村栄町
鹿児島県, 田原市来住町
岡山県, 一宮市田町
秋田県, 名古屋市北区小口川
鹿児島県, 阿蘇郡南小国町百々西町
宮崎県, 木田郡三木町藤塚
千葉県, 牧之原市久保田町江戸
山梨県, 泉南郡熊取町柏木町
徳島県, 遠田郡美里町俵原町
高知県, 伊達郡桑折町大本
佐賀県, 阪南市衣笠町
香川県, 山口市栄町
熊本県, 高浜市朽木平良
山形県, 足柄上郡松田町美熊台
秋田県, 北宇和郡鬼北町寺中町
宮城県, 盛岡市上麻生町
鹿児島県, 九戸郡九戸村靖国町
高知県, 東津軽郡外ヶ浜町只野
山口県, 長岡郡大豊町国分北
富山県, 荒尾市西改田松の木
香川県, 宍粟市光町
和歌山県, 赤穂市多田院西
熊本県, 甘楽郡下仁田町木造永田
徳島県, 宇都宮市東今小路町
長野県, 中野区富和
秋田県, 高松市久々宇
和歌山県, 余市郡赤井川村楢の木沢
鹿児島県, 紋別郡西興部村原町区堤谷
香川県, 東筑摩郡麻績村芸濃町中縄
沖縄県, 宮城郡利府町仁井田
山梨県, 斜里郡清里町八幡崎本宮
群馬県, 宮古郡多良間村高倉町
島根県, 裾野市陰平町
佐賀県, 江田島市夜須町羽尾
京都府, 神戸市垂水区赤坂
京都府, 奈良市永穂
埼玉県, 大阪狭山市木興町
鹿児島県, 葦北郡芦北町花尻ききょう町
山形県, 北村山郡大石田町西村町
栃木県, 土佐市西恋ケ窪
鳥取県, 長生郡白子町稲木町
宮城県, さいたま市桜区正木町新井
愛媛県, 南会津郡只見町額塚
山形県, 桑名郡木曽岬町花丘町
鳥取県, 上水内郡信濃町加登
和歌山県, 七尾市石田町池田仲触
鹿児島県, 三好市門田町
熊本県, 指宿市幸町
長崎県, 高萩市志々見町
鳥取県, 雲南市上ノ平
鳥取県, 白河市小原西
滋賀県, 広島市東区割田
沖縄県, 磯城郡田原本町八塩
佐賀県, 愛知郡愛荘町上麻生町
大分県, 松戸市児島小川
埼玉県, 浜松市東区北原山町鳴湫
沖縄県, 牛久市片倉町
岡山県, 北九州市若松区福田
徳島県, 湖西市五色町鮎原小山田
宮崎県, 八幡浜市養父元町
三重県, 大阪市東淀川区光町
秋田県, 宮古市府屋
岡山県, 習志野市新堀新田
青森県, 北設楽郡豊根村上熊本
宮城県, 国東市田谷沼
和歌山県, 三養基郡みやき町平成
岡山県, 室戸市藤塚
東京都, 最上郡戸沢村寺中町
新潟県, 上磯郡木古内町三木里町
福岡県, 南房総市力昼
茨城県, 福岡市博多区富和
徳島県, 豊川市本町
長野県, 狛江市志津川磯の沢
神奈川県, 山武市岩崎西
青森県, みやま市八尾町井田
栃木県, 茨木市弓越
宮城県, 佐渡市頸城区大蒲生田
佐賀県, 板野郡上板町宇治町
佐賀県, 小松市四日町
奈良県, 男鹿市小高区上町
島根県, 三次市西公文名
大阪府, 葛城市風早
千葉県, 幌泉郡えりも町追分青葉
宮城県, 鎌ケ谷市淀本町
岡山県, 石狩郡新篠津村梁川町上川原
鹿児島県, 雨竜郡秩父別町榛原澤
山梨県, 千葉市稲毛区鳥羽
山梨県, 田原市市振
三重県, 都城市上組郷
