佐賀県, 瑞浪市黒坂町
三重県, 北津軽郡中泊町立石町
埼玉県, 甘楽郡下仁田町駒ケ谷
福井県, 南巨摩郡早川町中津川
長野県, 大川市安土町宮津
鹿児島県, 倉敷市成子町
三重県, 京都市北区新先斗町
京都府, 西八代郡市川三郷町太秦安井藤ノ木町
山口県, 安八郡安八町北太田
東京都, 益田市御津町豊沢樽美
高知県, 赤穂市飾東町北山
沖縄県, 知多郡美浜町田越
東京都, 横浜市港北区鹿立
茨城県, さいたま市岩槻区大平
栃木県, 中間市南倉沢
大阪府, 河北郡津幡町本山町岡本
神奈川県, 阿武郡阿武町中町
青森県, 浜田市中村桜町
埼玉県, 佐渡市住吉町
鹿児島県, 田村郡三春町上田町
京都府, 阿蘇郡産山村上郷町来内
熊本県, 河沼郡湯川村小島田町
愛知県, 太田市北七区
宮城県, 勇払郡むかわ町木曽川町内割田
秋田県, 阿蘇郡西原村元学町
福島県, 東彼杵郡波佐見町福田
富山県, 河北郡内灘町大谷
富山県, 相楽郡和束町魚町
東京都, 小県郡長和町東立神町
高知県, 安曇野市頸城区大蒲生田
広島県, 吉野郡大淀町柏葉
広島県, 清須市潮見台
長野県, 益田市西上
三重県, 日野郡江府町竹下
沖縄県, 双葉郡大熊町吉川区泉
群馬県, 稲敷市和田山町岡田
石川県, 小浜市白鳥町
福島県, 高槻市竹鼻竹ノ街道町
奈良県, 飛騨市吾妻橋
新潟県, 嘉穂郡桂川町明和町
徳島県, 上川郡和寒町国衙
東京都, 上高井郡高山村前平町
新潟県, 東筑摩郡麻績村間々原新田
奈良県, 岩沼市高坂
秋田県, 東根市高田町
三重県, 石川郡古殿町大西町宮脇
埼玉県, 大野市石垣町西側
北海道, 肝属郡南大隅町城山町
長野県, 豊能郡豊能町宮ノ入
島根県, 和泉市有楽町
新潟県, 堺市中区麻生
福井県, えびの市貝皿
東京都, 那珂郡東海村上津江町川原
愛媛県, 木曽郡木祖村柿崎区城腰
香川県, 南秋田郡大潟村川島田
福島県, 生駒郡三郷町別府
静岡県, 京都市西京区滝尾
和歌山県, 泉大津市彦島
岡山県, 横浜市栄区江丹別町富原
青森県, 香美市輝北町下百引
島根県, 沼津市東間上町
山形県, 足柄下郡湯河原町伊保崎
石川県, 結城市小池
熊本県, 福岡市西区三口町
鳥取県, 横須賀市西町
兵庫県, 能美郡川北町南崩山町
沖縄県, 札幌市厚別区大野中央
東京都, 邑楽郡板倉町安土町宮津
熊本県, 名古屋市昭和区正福寺
和歌山県, 世田谷区八千代町勝田
埼玉県, 神崎郡神河町岩崎
山口県, 河東郡上士幌町上津江町川原
青森県, 香取郡東庄町久々宇
愛媛県, 芦屋市安養寺町
鳥取県, 福井市大津元町
愛媛県, うきは市築館沢入
石川県, 大島郡宇検村金山沢
北海道, 大阪市住之江区東浜町
岐阜県, 西置賜郡白鷹町相島
富山県, 渋川市太秦安井藤ノ木町
宮崎県, 幡多郡三原村竹野町浜須井
高知県, 沙流郡日高町京町
青森県, 那珂郡東海村西大寿台
三重県, 安来市福瀬町
大阪府, 河沼郡会津坂下町西平塚町
茨城県, 新座市八島町
和歌山県, 鳥栖市箕輪新田
高知県, 名寄市笛舞
山形県, 奈良市烏出川
福井県, 羽曳野市永穂
兵庫県, 足柄上郡開成町力丸町
高知県, 中新川郡舟橋村雄町
岐阜県, 海部郡牟岐町静平
岐阜県, 木田郡三木町富和
岩手県, 中津市力丸町
岩手県, 石川郡石川町松原
岐阜県, 福岡市西区新開町
兵庫県, 新見市安江町
東京都, 下益城郡美里町西ノ京笠殿町
北海道, 渋谷区岩井
宮城県, 大島郡与論町覚王寺
神奈川県, 志摩市南崩山町
山口県, 札幌市西区下甑町片野浦
静岡県, 安芸郡熊野町岩屋
大分県, 仲多度郡まんのう町常盤町
長崎県, 熊野市西町
宮城県, 大阪市淀川区力丸町
山口県, 牡鹿郡女川町三間町則
京都府, ひたちなか市菊水町
山梨県, 田村郡小野町久野本
愛知県, 射水市松林
石川県, 京都市伏見区弁天
滋賀県, 虻田郡ニセコ町深堀
福井県, 伊達郡川俣町間々原新田
香川県, 泉大津市嵯峨蜻蛉尻町
福島県, 新宮市すずらん台南町
北海道, 美濃加茂市材木町
神奈川県, 長生郡睦沢町東勝原
山形県, 隠岐郡知夫村西町
和歌山県, 東伯郡琴浦町すずらん台南町
香川県, 加茂市市野々
宮崎県, 中野市青海川
奈良県, 安芸郡府中町呉服町
三重県, 福井市安津見
山口県, 喜多方市茗荷沢新田
長野県, 上益城郡山都町坂本
鹿児島県, 広島市東区折谷町
岐阜県, 珠洲市香寺町中寺
京都府, 須崎市川原畑
福島県, 敦賀市辰巳町
群馬県, 紀の川市桂町
山形県, 芳賀郡益子町羽坂
岡山県, 天理市天王
滋賀県, 東伯郡北栄町三ツ矢橋
京都府, 富士見市早通
愛知県, 藤井寺市首里末吉町
佐賀県, 児湯郡新富町丸岡町上久米田
兵庫県, 京田辺市岩倉
埼玉県, 函館市仁川高台
秋田県, 足柄上郡中井町戸野目
長野県, 那珂郡東海村北迫町
兵庫県, 稲沢市吉田町
静岡県, 下伊那郡下條村十三東
岡山県, 北見市鵜飼年毛
岩手県, 北群馬郡吉岡町冬野町
静岡県, 宇治市西が迫
沖縄県, 伊予市熨斗戸
長野県, 山県郡安芸太田町浄法寺町樋口
香川県, 糸満市五郎
愛媛県, 土浦市今岡町
愛知県, 武蔵野市箕輪町
石川県, 国頭郡恩納村小泊坊主沢
福井県, 島尻郡与那原町長田
群馬県, 会津若松市西大寿台
宮城県, 南砺市衣川区天土
東京都, 東金市梅園町
石川県, 南佐久郡南牧村安江町
大阪府, 児玉郡神川町沢ケ内
香川県, 磯城郡田原本町上西郷
広島県, 船井郡京丹波町富吉
山梨県, 入間郡越生町栄町
福島県, 三戸郡南部町河田町
奈良県, 吾妻郡草津町坂本
徳島県, 東臼杵郡椎葉村二見町
東京都, 飯山市大本
岐阜県, 足柄上郡松田町谷
茨城県, 刈羽郡刈羽村相島
愛媛県, 北群馬郡榛東村大平
山梨県, 新潟市東区米山町愛宕前
長崎県, 龍ケ崎市坂井町若宮
福岡県, 小県郡長和町復井町
石川県, 宍粟市市野々
岐阜県, 上浮穴郡久万高原町高清水上佐野
新潟県, 習志野市稲毛町
石川県, 杵島郡大町町光地園
愛媛県, 名取市二の宮
宮城県, 四国中央市原町田
兵庫県, 山県市奥沢
福島県, 吉野郡吉野町中畑
青森県, 光市島原町
高知県, 猿島郡五霞町山川町牛ノ子尾
愛知県, 国立市永井町
富山県, 多治見市平出
長野県, 藤津郡太良町麻生
大分県, 吉田郡永平寺町国衙
広島県, 足寄郡足寄町京町
愛媛県, 双葉郡広野町樟陽台
秋田県, 奈良市中村桜町
茨城県, 奄美市碁点
福岡県, 茅野市薬師堂町
徳島県, 生駒郡平群町成田
京都府, 不破郡垂井町新シ町
埼玉県, 横浜市保土ケ谷区下平川
栃木県, 紋別郡湧別町浄法寺町樋口
宮崎県, 勇払郡むかわ町牛込
福島県, 総社市天白町植田
埼玉県, 南国市台ケ窪
沖縄県, ひたちなか市榛原澤
大阪府, 夕張市御蔵島村一円
青森県, 岩船郡粟島浦村西公文名
富山県, 上北郡七戸町京北柏原町
長崎県, 横浜市神奈川区成子町
沖縄県, 加古川市大蔵
宮城県, 西松浦郡有田町松ケ崎東桜木町
長崎県, 焼津市新野東
神奈川県, 東広島市上ノ平
宮崎県, 南津軽郡大鰐町下小南川
岡山県, 美祢市新町
奈良県, 南房総市丸屋町
三重県, 度会郡大紀町員弁町平古
岐阜県, 山鹿市宝町
埼玉県, 豊田郡大崎上島町成合南の町
沖縄県, 北九州市八幡西区東立神町
静岡県, 北松浦郡小値賀町瑞穂町西郷丙
富山県, 稲敷市浄法寺町樋口
茨城県, 長生郡長南町内馬場町
青森県, 北秋田郡上小阿仁村相川羽田町
島根県, 大島郡徳之島町牛込
千葉県, 和賀郡西和賀町増穂
愛知県, 南国市ダイハツ町
高知県, 沼津市門前町小山
岩手県, 仲多度郡多度津町熨斗戸
沖縄県, 広尾郡大樹町天応南町
山形県, 度会郡大紀町古市場東町田
千葉県, 八女市五郎
富山県, 仙北郡美郷町衣川区天土
大阪府, 有田市東勝原
鳥取県, 樺戸郡浦臼町月舘
福岡県, 球磨郡湯前町永福町
福岡県, 網走郡大空町山川町牛ノ子尾
沖縄県, 熊毛郡平生町上段
京都府, 虻田郡喜茂別町龍岡町下條南割
福岡県, 茅ヶ崎市鷺浦町向田野浦
秋田県, 熊本市中央区東九条西札辻町
徳島県, 糟屋郡宇美町元町
佐賀県, 山武郡九十九里町東和町石持
宮城県, 大阪狭山市烏出川
宮崎県, 上尾市月舘
岐阜県, 香美市南庄町
愛知県, 赤穂市谷田
大阪府, 柳川市遠若町
北海道, 富士吉田市新浜町
新潟県, 日光市多田
愛知県, 熊毛郡南種子町岩崎
岡山県, 甲斐市三和町辻
福井県, 福島市和泉
山形県, 大阪市住吉区廿五里
山口県, 美濃市岩崎
青森県, 東白川郡鮫川村南方
徳島県, 福井市本宮町
鹿児島県, 古河市坪山
広島県, 岡山市北区大雄東中島
青森県, 大分市元学町
和歌山県, 下伊那郡天龍村八島町
群馬県, 鹿角市久米
福岡県, 上川郡愛別町原町区堤谷
福島県, 糟屋郡志免町東原町
鳥取県, 勝山市田谷沼
山口県, 大野城市天満下川原
福島県, 吹田市芝之町
滋賀県, 余市郡余市町対雁
佐賀県, 国頭郡宜野座村寄木町秋葉
山口県, 仲多度郡琴平町城山町
兵庫県, 長生郡長生村山那
岩手県, 長生郡睦沢町木戸
福井県, 唐津市大津元町
富山県, 北茨城市中央通
千葉県, 南巨摩郡富士川町嵯峨広沢御所ノ内町
愛媛県, 南会津郡南会津町山崎
神奈川県, 最上郡最上町葛川
大分県, 下伊那郡高森町東城内
兵庫県, 江南市西七条中野町
愛媛県, 比企郡小川町新先斗町
長崎県, 八頭郡智頭町東野町西神田
茨城県, 霧島市大淀南
富山県, 山本郡八峰町首里末吉町
三重県, 国頭郡国頭村立川町
長野県, 加茂郡東白川村天神新
広島県, 新島村高畑町
宮城県, 藤沢市戸出延島
鳥取県, 神埼郡吉野ヶ里町東九条西札辻町
東京都, 古河市弁天
鳥取県, 北区平佛供田町
富山県, 生駒市北方町板上
愛媛県, 大島郡周防大島町本宮北ノ内
熊本県, 輪島市陽光園
三重県, 福岡市早良区上神輿町
宮城県, 鞍手郡鞍手町波積町本郷
埼玉県, 千葉市若葉区谷地前
栃木県, 東かがわ市金町
奈良県, 北斗市藤代町
千葉県, 柴田郡大河原町西鴻池町
岡山県, 比企郡川島町中子
高知県, 赤穂市前田
島根県, 遠賀郡水巻町永井町
東京都, 甲賀市竹町
広島県, 長岡郡大豊町十日町
佐賀県, 福島市北町
佐賀県, 山武郡横芝光町鹿島台船越
大分県, 下関市元土御門町
千葉県, 北茨城市新開町
香川県, 桜井市西日暮里
千葉県, 高砂市宍道町白石
沖縄県, 上川郡美瑛町首里末吉町
福島県, 岩手郡雫石町片倉町
愛媛県, 横手市竹田向代町川町
福島県, 男鹿市鴨居
愛知県, 揖保郡太子町深草森吉町
福井県, 木曽郡上松町吾妻橋
京都府, 北本市箕輪新田
宮城県, 留萌市大町
三重県, 大町市宮津口
宮城県, 上水内郡小川村香寺町中寺
新潟県, 空知郡上砂川町下曽根
愛媛県, 海部郡牟岐町本宮北ノ内
兵庫県, 国頭郡金武町坂本
福井県, 吉田郡永平寺町山城町末貞
富山県, みよし市久居藤ケ丘町
和歌山県, 常陸大宮市赤城町
茨城県, 薩摩川内市田宮本町
山梨県, 上川郡東神楽町西条町西条東
山梨県, 横浜市港南区中町
岩手県, 足柄下郡箱根町酪陽
大分県, 北松浦郡佐々町赤坂
福岡県, 板野郡北島町石上
沖縄県, 南埼玉郡宮代町十三東
岐阜県, 小松市三潴町清松
滋賀県, 大阪市生野区高来町法川
鳥取県, 富士市仁江町
鹿児島県, 河東郡音更町稲毛町
大分県, 高梁市螺湾
東京都, 足柄上郡松田町直島町一円
兵庫県, 東津軽郡今別町高山町
神奈川県, 川崎市麻生区弓削日比
北海道, 安曇野市龍神村西
宮崎県, 唐津市真家
静岡県, 広島市安佐南区城島町芦塚
大分県, 賀茂郡河津町芦川町鶯宿
静岡県, 福岡市城南区力丸町
奈良県, 鹿島郡中能登町松山
新潟県, 津市川原畑
岡山県, 南魚沼郡湯沢町寒昇
福島県, 西蒲原郡弥彦村美山町和泉
兵庫県, 札幌市手稲区蛭子町
岩手県, 苫前郡初山別村住吉町
岩手県, 双葉郡双葉町奈川
大阪府, 下呂市上溝
東京都, 奈良市一色町
宮崎県, 島尻郡座間味村木葉下町
佐賀県, 金沢市奈川
香川県, 新宮市大町
宮城県, 竹原市養父元町
山形県, 八戸市伏木古府元町
滋賀県, 高崎市河田町
鳥取県, 熊毛郡中種子町寺中町
栃木県, 島田市光町
高知県, 大府市山川町牛ノ子尾
山形県, 茅野市大野原町福田原
京都府, 府中市中村道ノ下
石川県, 昭島市新先斗町
岩手県, 奄美市遠若町
秋田県, 三戸郡南部町八島町
宮崎県, 横須賀市欠之上
三重県, 中郡大磯町竹鼻竹ノ街道町
福井県, 南魚沼市木落
三重県, 東諸県郡綾町上奈良東ノ口
千葉県, 八千代市住吉町
滋賀県, 目黒区天王下
山口県, 玖珠郡九重町大町
三重県, 三浦郡葉山町杷木星丸
愛知県, 山武郡九十九里町紫野東御所田町
群馬県, 川口市佐田町八幡原
鳥取県, 紋別郡西興部村瑞穂町西郷丙
北海道, 出雲市姥袋町
岡山県, 曽於市行人町
沖縄県, 賀茂郡松崎町復井町
高知県, 根室市上早川
神奈川県, 鈴鹿市桧岱
岐阜県, 三浦郡葉山町本渡町本渡
徳島県, 高岡郡日高村桂町
愛知県, 尾花沢市白山
広島県, 藤岡市久野本
島根県, 河内長野市桂町
福島県, 喜多郡内子町旭天神町
静岡県, 本庄市久美浜町葛野
宮崎県, 勝浦郡勝浦町十三東
沖縄県, 猿島郡境町吉田町川手
茨城県, 飯山市川辺町両添
長崎県, 下伊那郡大鹿村曽根
長野県, 下伊那郡阿智村夜須町羽尾
石川県, 阿蘇郡高森町下新庄町
広島県, 下伊那郡阿智村田越
福岡県, 千葉市中央区津島町
福井県, 八代市飯沢
宮城県, 伊予郡砥部町西町
長野県, 高市郡明日香村額塚
愛媛県, 勇払郡むかわ町高山町
東京都, 南宇和郡愛南町形山みどり町
群馬県, 糸満市愛の杜
高知県, 本巣郡北方町新旭町
石川県, 新発田市八木
宮崎県, 下北郡佐井村今宿
福島県, 中巨摩郡昭和町芝之町
茨城県, 小樽市梨木町
神奈川県, 安中市吉川区泉
長野県, 気仙郡住田町中里
千葉県, 吾妻郡東吾妻町中村道ノ下
和歌山県, 樺戸郡浦臼町貝皿
兵庫県, 嬉野市吉舎町敷地
山口県, 札幌市中央区喰代
山形県, 勇払郡占冠村毛成
東京都, 足柄上郡大井町衣笠町
栃木県, 宗像市千代川町今津
愛知県, 垂水市碇ケ関古懸鳥井
和歌山県, 西多摩郡日の出町覚王寺
香川県, 泉南郡岬町駅前
岐阜県, 双葉郡楢葉町山川町牛ノ子尾
三重県, 仙台市宮城野区名越
滋賀県, 仙台市若林区高来町法川
香川県, 松浦市播磨町
福井県, 北九州市若松区永田
奈良県, 酒田市滝元
岩手県, 日野市茗荷沢新田
熊本県, 隠岐郡西ノ島町勝部
大阪府, 糟屋郡須惠町小栗栖石川町
富山県, 竹田市梅園町
宮崎県, 前橋市楯山
宮城県, 猿島郡五霞町蔵本新
長崎県, 壱岐市額田南郷
山梨県, 妙高市木津屋町
茨城県, 東大和市里見町
大阪府, 船橋市丸屋町
石川県, 紋別郡西興部村菜園場
熊本県, 新座市大津元町
静岡県, 球磨郡多良木町高倉町
岩手県, 裾野市志々見町
富山県, 夷隅郡御宿町沓掛
宮崎県, 鳥羽市雲ケ畑出谷町
東京都, 鈴鹿市谷原
岡山県, 苫小牧市南町
愛媛県, 門真市岩崎
山梨県, 諏訪市山崎
石川県, 小山市国分北
佐賀県, 尾花沢市鹿立
愛媛県, 勝浦市黒坂町
山形県, 三条市南金屋
北海道, 大阪市西区東金屋
奈良県, 足利市俵柳
鳥取県, 東牟婁郡那智勝浦町本町
広島県, 広島市東区草安
栃木県, 西多摩郡日の出町猫田
埼玉県, 羽咋郡宝達志水町高坂
香川県, 山陽小野田市木葉下町
千葉県, うきは市滝本
静岡県, 南会津郡只見町緑台
岩手県, 新見市原町区堤谷
東京都, 賀茂郡南伊豆町浪岡北中野
熊本県, 足柄上郡大井町松街道
三重県, 水戸市美川末広町
富山県, 遠田郡涌谷町谷口
愛知県, 安芸郡東洋町子安町
秋田県, 北設楽郡設楽町円阿弥
広島県, 伊豆の国市神指町如来堂
山形県, 四国中央市岡部町青羽根
熊本県, 宮城郡利府町靖国町
愛媛県, 下伊那郡阿南町坂本
島根県, 古河市伊呉野
香川県, 菊川市幸町
山口県, 北安曇郡池田町海津町高須町
石川県, 滝川市香住区大野
滋賀県, 川上郡弟子屈町平沢
福島県, 熊毛郡田布施町栗原
広島県, 黒川郡大郷町古川町
新潟県, 葦北郡芦北町市野々
大阪府, 北群馬郡吉岡町北迫町
島根県, 都留市鹿の子台南町
石川県, 海部郡海陽町川島渡町
宮城県, 三戸郡新郷村国府町和田
香川県, 四街道市小林
鳥取県, 海草郡紀美野町桜馬場町
福岡県, 諏訪郡原村中町
沖縄県, 見附市嵯峨広沢御所ノ内町
三重県, 吹田市本宮北ノ内
宮城県, 島尻郡渡名喜村岸城町
長崎県, 最上郡舟形町志津川磯の沢
鹿児島県, 静岡市葵区城北町
香川県, 朝霞市西鴻池町
福岡県, 西牟婁郡上富田町上名生
島根県, 大田市田代
神奈川県, 上益城郡甲佐町坂下新田
宮崎県, 上尾市池見
宮崎県, 羽村市波多津町津留主屋
奈良県, 相楽郡精華町稲木町
鹿児島県, 美方郡香美町十日町
山梨県, 南会津郡只見町来住町
長野県, 西村山郡朝日町海瀬
石川県, 杵島郡白石町砂金町
新潟県, 須坂市尾崎丁
大阪府, 串間市子安町
京都府, 安芸郡北川村力昼
宮城県, 四国中央市学園赤松町
岩手県, 吉野郡川上村戸野目
佐賀県, 田方郡函南町豊里町長根浦
高知県, 上益城郡山都町鹿勝川町
千葉県, 羽咋市駒木台
山形県, 墨田区麻生
茨城県, 鹿児島郡三島村油町
大分県, 大阪市都島区秋山
熊本県, 南巨摩郡早川町円山町
北海道, 国頭郡恩納村喰代
和歌山県, 浅口郡里庄町永福町
香川県, 仲多度郡琴平町山田町
北海道, 十和田市梨ケ原
岩手県, 下閉伊郡田野畑村陽光園
埼玉県, 新潟市北区霞町
神奈川県, 東筑摩郡生坂村木葉下町
宮城県, 吉田郡永平寺町中
神奈川県, 南会津郡南会津町田越
滋賀県, 小美玉市里の杜
滋賀県, 旭川市平田
宮崎県, 神戸市中央区犬伏
熊本県, 下水内郡栄村大佐小阪部
宮崎県, 藤枝市松明町
大分県, 中川郡本別町元町
大阪府, 下伊那郡平谷村月美町
静岡県, 河沼郡会津坂下町桧岱
山口県, 枕崎市花園町
奈良県, 平戸市和見町
茨城県, 坂井市柏木町
新潟県, 神崎郡福崎町元土御門町
岡山県, 薩摩川内市西改田松の木
大分県, 岩瀬郡天栄村東口道上
長崎県, 那須郡那須町翠ケ丘町
長崎県, 紋別郡湧別町柿
秋田県, 桐生市中村道ノ下
佐賀県, 富士宮市来住町
大分県, 上水内郡信濃町奥沢
栃木県, 松前郡福島町難波千日前
佐賀県, 八丈島八丈町新磯子町
群馬県, さいたま市南区新屋敷町
山形県, 上越市中町
大分県, 隠岐郡海士町衣川区天土
山梨県, 高岡郡佐川町緑台
岡山県, 薩摩郡さつま町前田
岡山県, 上北郡おいらせ町早苗町
大分県, 西津軽郡鰺ヶ沢町宮ノ入
長野県, 御坊市寿町
群馬県, 朝倉郡筑前町蛭子町
兵庫県, 安芸郡安田町箕輪町
新潟県, 河内郡上三川町鷹峯堀越町
京都府, 南巨摩郡富士川町伏木古府元町
福岡県, 積丹郡積丹町永田
神奈川県, 三笠市翠ケ丘町
静岡県, 高市郡明日香村佐渡
福井県, 高梁市大久保
京都府, 米子市坂本
佐賀県, 北葛城郡王寺町梨木町
千葉県, 上天草市甲徳兵衛町
秋田県, 荒尾市大田沓掛
石川県, 高槻市芦垣
神奈川県, 雨竜郡雨竜町彦島
福岡県, 大野城市正岡神田
埼玉県, 豊橋市岩崎
鹿児島県, 南津軽郡田舎館村衣川区天土
石川県, 田川郡香春町東勝原
岡山県, 北葛城郡上牧町下平川
兵庫県, 浦河郡浦河町長山
兵庫県, 千歳市宇留院内
大分県, 児湯郡西米良村里の杜
青森県, 西諸県郡高原町新浦島町
秋田県, 広島市南区福貴
滋賀県, 神戸市灘区有楽町
和歌山県, 横浜市戸塚区八田
神奈川県, 天理市福正町
東京都, 鎌倉市国分北
鳥取県, 比企郡川島町小林
愛知県, 泉佐野市西改田松の木
岐阜県, 爾志郡乙部町中津隈
神奈川県, 様似郡様似町和見町
沖縄県, 伊豆の国市楢の木沢
宮崎県, 上北郡六ヶ所村新開町
愛知県, 草加市弁天
石川県, 北名古屋市木落
岩手県, 滑川市北七区
和歌山県, 東温市麻生
茨城県, 君津市東城内
香川県, 乙訓郡大山崎町谷
鹿児島県, 坂戸市西新町
岡山県, 中央区厳木町牧瀬
青森県, 南条郡南越前町美山町和泉
静岡県, 勝山市上対馬町五根緒
茨城県, 標津郡中標津町大里
千葉県, 一関市松尾町借毛本郷
埼玉県, 吉野郡天川村児島小川
千葉県, 国頭郡宜野座村犬伏
青森県, 那珂川市美川末広町
長崎県, 下都賀郡野木町大里
和歌山県, 球磨郡湯前町万代町
福島県, 大阪市生野区園原
埼玉県, 三養基郡上峰町下津林番条町
香川県, 東村山市岩崎
愛媛県, 飯田市梅園町
東京都, 柴田郡柴田町上田の口
宮城県, 伊勢市稲木町
鳥取県, 松浦市豊町
茨城県, 行橋市谷
高知県, 留萌市宮丸
鳥取県, 竹田市中島町
福岡県, あま市龍岡町下條南割
山形県, 島尻郡北大東村和合
茨城県, 印旛郡栄町松明町
神奈川県, 五島市仁井田
大阪府, 泉南郡岬町高崎町縄瀬
青森県, 島尻郡南風原町山川町矢落
愛媛県, 熊本市西区梅園町
広島県, 鳥栖市宮野下
岡山県, 角田市野間
京都府, 北上市豊郷
高知県, 山武市永福町
神奈川県, 日野郡江府町藤井町
大阪府, 上川郡上川町大杉
滋賀県, 熊毛郡上関町三川
長野県, 北村山郡大石田町仁井田潟中町
愛媛県, 三戸郡田子町留辺蘂町金華
長崎県, 加茂郡八百津町上早川
山口県, 上川郡新得町西が迫
新潟県, 柴田郡川崎町薬利
岩手県, 海津市三潴町清松
鳥取県, 八重山郡竹富町日乃出町
三重県, 下閉伊郡普代村貝柄
千葉県, 美祢市三軒家東
島根県, 東臼杵郡椎葉村大橋
大阪府, 枕崎市中村道ノ下
新潟県, 室戸市砂金町
福井県, 沙流郡平取町大橋町
鹿児島県, 浜松市北区力丸町
北海道, 雨竜郡雨竜町栄生町
静岡県, 銚子市木ノ庄町木梨山方
石川県, 角田市東金屋
神奈川県, 那珂郡東海村白山
三重県, 稲沢市草深
島根県, 杉並区呉服町
石川県, 三戸郡五戸町栄生町
東京都, 志木市温泉
岐阜県, 横浜市戸塚区苗振谷地
千葉県, 西彼杵郡時津町坂下新田
群馬県, 薩摩郡さつま町衣笠町
高知県, 名古屋市名東区大貞
鹿児島県, 雄勝郡東成瀬村宇留院内
熊本県, 愛甲郡清川村覚王寺
青森県, 京丹後市弓削日比
富山県, 猿島郡五霞町芥田
徳島県, 八女市田所町
福井県, 藤枝市仁川高台
三重県, 柏市田中町
大分県, 那須烏山市安江町
鹿児島県, 岩手郡雫石町米崎町
宮城県, 一関市福貴
長崎県, 岩出市桜作
岐阜県, 岡山市中区清水村松地先新田
茨城県, 富士見市上奈良東ノ口
徳島県, 西置賜郡飯豊町壬生甲
鳥取県, 下伊那郡豊丘村白木
佐賀県, 北杜市三木里町
高知県, 吾川郡いの町仁江町
栃木県, 大島郡周防大島町柏木町
栃木県, 福生市並木
福井県, 長野市曲新町
大分県, 吉野郡下市町頸城区大蒲生田
徳島県, 洲本市旭町
鹿児島県, 今治市稲荷町
広島県, 上水内郡信濃町東沢田
群馬県, 名護市米島
石川県, 鹿児島市名田庄奥坂本
高知県, 能美市七日町
山口県, 嬉野市日乃出町
青森県, 福岡市中央区城新田
青森県, 加賀市赤橋
宮城県, 朝倉市木興町
秋田県, 秩父郡皆野町大堀
福岡県, 帯広市水元町
広島県, 南巨摩郡南部町只野
山口県, 津市小島田町
新潟県, 筑後市坂本
秋田県, 行方市松尾
大分県, 小矢部市龍神村西
新潟県, 石川郡平田村吉舎町敷地
沖縄県, 度会郡度会町松原
静岡県, 貝塚市猫沢
山口県, 岩手郡葛巻町堀口町
福岡県, 福生市開田
高知県, 中野市山王臨海町
福井県, 関市大浜
